id,timestamp,ownerUsername,text,likesCount,postUrl,commentUrl
18026184818531611,2025-09-22T08:41:07+00:00,marli_an22,Sampe kapan down nya pak? Udah setres ini kerjaan numpuk🔥,1,https://www.instagram.com/pajakbadsel/reel/DOxJksiE3nW/,https://www.instagram.com/pajakbadsel/reel/DOxJksiE3nW/?comment_id=18026184818531611
18079988752799606,2025-09-22T08:21:00+00:00,98v.naaa_,ini knp coretax gbs di akses lg sih? pusing,1,https://www.instagram.com/pajakbadsel/reel/DOxJksiE3nW/,https://www.instagram.com/pajakbadsel/reel/DOxJksiE3nW/?comment_id=18079988752799606
18078925457316923,2025-09-22T08:20:50+00:00,mikhael.kurnia003,Betul dikit la coretax nya kontolllll,0,https://www.instagram.com/pajakbadsel/reel/DOxJksiE3nW/,https://www.instagram.com/pajakbadsel/reel/DOxJksiE3nW/?comment_id=18078925457316923
18054465716547407,2025-09-22T08:14:13+00:00,ngurahputraaa_,"tolong segera di fix coretax, anggaran triliunan bisa cari jasa orang coding yang lebih profesional dan bisabekerja cepat",2,https://www.instagram.com/pajakbadsel/reel/DOxJksiE3nW/,https://www.instagram.com/pajakbadsel/reel/DOxJksiE3nW/?comment_id=18054465716547407
18315561484246361,2025-09-22T08:10:19+00:00,sany.alfa.pratama,"Buset downtime ga ada kabar berita di weekday pula, kenapa ga pas weekend kmarin aja downtimenya???",3,https://www.instagram.com/pajakbadsel/reel/DOxJksiE3nW/,https://www.instagram.com/pajakbadsel/reel/DOxJksiE3nW/?comment_id=18315561484246361
18076406603089583,2025-09-22T08:10:08+00:00,kia_za_k89,"Bapak/Ibu yang terhormat, jika ingin memaintenance program Anda, jangan dihari kerja dan jam kerja, sungguh itu sangat mengganggu aktivitas kami. Tq.",0,https://www.instagram.com/pajakbadsel/reel/DOxJksiE3nW/,https://www.instagram.com/pajakbadsel/reel/DOxJksiE3nW/?comment_id=18076406603089583
18091801831753890,2025-09-22T08:09:09+00:00,agajayadi,Harus ya ini web coretax jam segini maintenance ??? Hadeuhh ampunn,2,https://www.instagram.com/pajakbadsel/reel/DOxJksiE3nW/,https://www.instagram.com/pajakbadsel/reel/DOxJksiE3nW/?comment_id=18091801831753890
18020916410568137,2025-09-22T08:07:07+00:00,maria.na19250,Gimana nih Pak @bimbimo gini amat maintenance nya? Hari kerja lho! Aplikasi anda itu harga 1T lho Pak?!!! Tanggung jawab. Kalo gak bisa digunakan mending kembalikan tuh uang rakyat yg 1T dari pada beli aplikasi murahan begitu,2,https://www.instagram.com/pajakbadsel/reel/DOxJksiE3nW/,https://www.instagram.com/pajakbadsel/reel/DOxJksiE3nW/?comment_id=18020916410568137
17945316270047199,2025-09-22T08:06:38+00:00,mellaniaaa01,Kalo downtime jangan di jam dan saat kerja dong. Kan bisa tengah malem. Kantor gua kantor IT smua kerja kalo mau maintenance startnya sore atau malem bahkan tengah malem.,1,https://www.instagram.com/pajakbadsel/reel/DOxJksiE3nW/,https://www.instagram.com/pajakbadsel/reel/DOxJksiE3nW/?comment_id=17945316270047199
18014955665606449,2025-09-22T08:01:55+00:00,karpusss,"Tolong udah tanggal berapa ini, server downtime 3 hari gini bikin susah terus pak @menkeuri",1,https://www.instagram.com/pajakbadsel/reel/DOxJksiE3nW/,https://www.instagram.com/pajakbadsel/reel/DOxJksiE3nW/?comment_id=18014955665606449
18008435771629921,2025-09-22T08:01:25+00:00,cattleyaputri,@purbayayudhi_official pak coretax nya mohon pak. Kita yg kena susahnya disangka ga bener kerja sm pimpinan pak. Mau smp Kapan,0,https://www.instagram.com/pajakbadsel/reel/DOxJksiE3nW/,https://www.instagram.com/pajakbadsel/reel/DOxJksiE3nW/?comment_id=18008435771629921
17878672326297055,2025-09-22T08:00:51+00:00,maria.na19250,Kenapa tuh gak ada story nya? Adminnya gak ada kerjaan dong? Makan gaji buta ya lo min? Parah banget rakyat diperas buat bayar pajak yang digunakan untuk bayar admin IG yang ggak kerja.,0,https://www.instagram.com/pajakbadsel/reel/DOxJksiE3nW/,https://www.instagram.com/pajakbadsel/reel/DOxJksiE3nW/?comment_id=17878672326297055
18064613984201304,2025-09-22T08:00:24+00:00,tisugalon,"website busuk warisan sri mulyono tolong dibenerin, atau bagusnya dihapus aja sekalian ga usah bayar pajak kali ya @menkeuri",1,https://www.instagram.com/pajakbadsel/reel/DOxJksiE3nW/,https://www.instagram.com/pajakbadsel/reel/DOxJksiE3nW/?comment_id=18064613984201304
18110028490482987,2025-09-22T08:00:03+00:00,andikaumbara96,"Tolonglah jngn kebanyakan eror sistemnya,sekali kali bikin wp enak nyaman gk harus eros,gk harus aktivasi ini itu,dana triliuanan masa masih bikin wp pusing gk cengli lah bos.",1,https://www.instagram.com/pajakbadsel/reel/DOxJksiE3nW/,https://www.instagram.com/pajakbadsel/reel/DOxJksiE3nW/?comment_id=18110028490482987
18063074768589554,2025-09-22T07:57:51+00:00,charmans_boy,Noh kerjanya perlu diapresiasi😂 @kemenkeuri @kemenkeumengajar @setjenkemenkeu @itjenkemenkeu,2,https://www.instagram.com/pajakbadsel/reel/DOxJksiE3nW/,https://www.instagram.com/pajakbadsel/reel/DOxJksiE3nW/?comment_id=18063074768589554
18072673874152959,2025-09-22T07:55:36+00:00,dtri.w970,@official.kpk @prabowo @menkeuri,1,https://www.instagram.com/pajakbadsel/reel/DOxJksiE3nW/,https://www.instagram.com/pajakbadsel/reel/DOxJksiE3nW/?comment_id=18072673874152959
18018886799586824,2025-09-22T07:53:59+00:00,itcie,"Waspadaaa, coretax napa eror muluu, udah kmrn 2 hr maint msh kurang yaaa. Hadeh @ditjenpajakri",0,https://www.instagram.com/pajakbadsel/reel/DOxJksiE3nW/,https://www.instagram.com/pajakbadsel/reel/DOxJksiE3nW/?comment_id=18018886799586824
17926443621108834,2025-09-22T07:53:52+00:00,annisa_wulan1903,Balikin deh mendingan duit rakyat yang dipake untuk aplikasi gak guna,1,https://www.instagram.com/pajakbadsel/reel/DOxJksiE3nW/,https://www.instagram.com/pajakbadsel/reel/DOxJksiE3nW/?comment_id=17926443621108834
18387744064193505,2025-09-22T07:53:08+00:00,marutzkaa,Coretaxxxx benerin anjai😢,0,https://www.instagram.com/pajakbadsel/reel/DOxJksiE3nW/,https://www.instagram.com/pajakbadsel/reel/DOxJksiE3nW/?comment_id=18387744064193505
18134064337457401,2025-09-22T07:41:15+00:00,hoonnaayyy,Down mulu herannn,1,https://www.instagram.com/pajakbadsel/reel/DOxJksiE3nW/,https://www.instagram.com/pajakbadsel/reel/DOxJksiE3nW/?comment_id=18134064337457401
18026010203726549,2025-09-22T07:36:28+00:00,f3rdy__,"tgl 20 downtime ga bisa upload faktur pajak Agustus, tgl 22 downtime ga bisa lapor PPh Potput.... rasanya gimana gituh dapet hadiah COMBO dari @ditjenpajakri 🎉🎉🎉🎉",0,https://www.instagram.com/pajakbadsel/reel/DOxJksiE3nW/,https://www.instagram.com/pajakbadsel/reel/DOxJksiE3nW/?comment_id=18026010203726549
18080422558810867,2025-09-22T07:33:43+00:00,reprimandedson,Coretax downtime padahal tadi pagi masih bisa buat FP,1,https://www.instagram.com/pajakbadsel/reel/DOxJksiE3nW/,https://www.instagram.com/pajakbadsel/reel/DOxJksiE3nW/?comment_id=18080422558810867
18055991924625428,2025-09-22T07:33:19+00:00,annisa_wulan1903,Kurang ya waktu dua hari untuk maintenance nya????? HAH??? harga milyaran tapi aplikasi nya ece² gini?! @purbaya_yudhi,0,https://www.instagram.com/pajakbadsel/reel/DOxJksiE3nW/,https://www.instagram.com/pajakbadsel/reel/DOxJksiE3nW/?comment_id=18055991924625428
18085949113895492,2025-09-22T07:32:34+00:00,asephamii,sampah,0,https://www.instagram.com/pajakbadsel/reel/DOxJksiE3nW/,https://www.instagram.com/pajakbadsel/reel/DOxJksiE3nW/?comment_id=18085949113895492
18067173863194269,2025-09-22T07:29:49+00:00,isty_istikomah,"Coretax Tolong dong , udah mah downtime trus.. mana error juga",0,https://www.instagram.com/pajakbadsel/reel/DOxJksiE3nW/,https://www.instagram.com/pajakbadsel/reel/DOxJksiE3nW/?comment_id=18067173863194269
18404168620139949,2025-09-22T07:29:21+00:00,andy_zhang22,Coretax kring kring,0,https://www.instagram.com/pajakbadsel/reel/DOxJksiE3nW/,https://www.instagram.com/pajakbadsel/reel/DOxJksiE3nW/?comment_id=18404168620139949
17883708201381304,2025-09-22T07:29:04+00:00,yuli_ana_azzahra,Muak bgt sumpah,1,https://www.instagram.com/pajakbadsel/reel/DOxJksiE3nW/,https://www.instagram.com/pajakbadsel/reel/DOxJksiE3nW/?comment_id=17883708201381304
18041989988418146,2025-09-22T07:28:21+00:00,jefryali86,Yang kesusahan pembuatan npwp bisa wa gays,0,https://www.instagram.com/pajakbadsel/reel/DOxJksiE3nW/,https://www.instagram.com/pajakbadsel/reel/DOxJksiE3nW/?comment_id=18041989988418146
18111313876542521,2025-09-22T07:27:46+00:00,rmuhammadanggaa,Faktur numpuk nih jadinya hmm,1,https://www.instagram.com/pajakbadsel/reel/DOxJksiE3nW/,https://www.instagram.com/pajakbadsel/reel/DOxJksiE3nW/?comment_id=18111313876542521
17971341908939392,2025-09-22T07:25:41+00:00,sizhuro,Kualitas coretax nya sering error,1,https://www.instagram.com/pajakbadsel/reel/DOxJksiE3nW/,https://www.instagram.com/pajakbadsel/reel/DOxJksiE3nW/?comment_id=17971341908939392
18524902699057249,2025-09-22T07:25:08+00:00,dylvrliiya_,down lagi? 😭,1,https://www.instagram.com/pajakbadsel/reel/DOxJksiE3nW/,https://www.instagram.com/pajakbadsel/reel/DOxJksiE3nW/?comment_id=18524902699057249
17942042057932672,2025-09-22T07:23:00+00:00,galangsmovie7,"Maintenance udah 3 hari gk kelar-kelar, gangguin orang kerja doang.
giliran mintain duit denda cepet banget",1,https://www.instagram.com/pajakbadsel/reel/DOxJksiE3nW/,https://www.instagram.com/pajakbadsel/reel/DOxJksiE3nW/?comment_id=17942042057932672
17922516351153038,2025-09-22T07:21:36+00:00,shafiraalifianael,"Bisa2nya downtime disiang bolong kek gini, klo bikin web tuh pake third party yang berkualitas dong.. gelontorin uang negara besar2an bikin web abal2.. 😭😏 udh jalan 9 bulan loh pak/bu.. tolong dibenahi secepatnya!",2,https://www.instagram.com/pajakbadsel/reel/DOxJksiE3nW/,https://www.instagram.com/pajakbadsel/reel/DOxJksiE3nW/?comment_id=17922516351153038
18087965452853787,2025-09-22T07:21:32+00:00,vareztaaa,jangan nyusahin wp sekali aja bisa?,1,https://www.instagram.com/pajakbadsel/reel/DOxJksiE3nW/,https://www.instagram.com/pajakbadsel/reel/DOxJksiE3nW/?comment_id=18087965452853787
17896032840298943,2025-09-22T07:17:30+00:00,deanakavi,"KAK, CORETAX MU ERROR MULU",3,https://www.instagram.com/pajakbadsel/reel/DOxJksiE3nW/,https://www.instagram.com/pajakbadsel/reel/DOxJksiE3nW/?comment_id=17896032840298943
18088109101853171,2025-09-22T07:17:22+00:00,ifahdartn_,hei anda gimana si down pas hari kerja,2,https://www.instagram.com/pajakbadsel/reel/DOxJksiE3nW/,https://www.instagram.com/pajakbadsel/reel/DOxJksiE3nW/?comment_id=18088109101853171
18081014177498031,2025-09-22T07:17:22+00:00,syafinaaziza,"Woy pukimak ini coretax gabisa di akses, bayar mahal doang webnya, error mulu kerjaannya, g becus abis👏",0,https://www.instagram.com/pajakbadsel/reel/DOxJksiE3nW/,https://www.instagram.com/pajakbadsel/reel/DOxJksiE3nW/?comment_id=18081014177498031
18341382121160381,2025-09-22T07:11:54+00:00,penikmatlagu_dhtitik,Gangguan min?,1,https://www.instagram.com/pajakbadsel/reel/DOxJksiE3nW/,https://www.instagram.com/pajakbadsel/reel/DOxJksiE3nW/?comment_id=18341382121160381
18365570140151316,2025-09-22T07:09:48+00:00,efi_war,Menyala sekali  coretax hari senin🔥🔥🔥,3,https://www.instagram.com/pajakbadsel/reel/DOxJksiE3nW/,https://www.instagram.com/pajakbadsel/reel/DOxJksiE3nW/?comment_id=18365570140151316
18073108325123393,2025-09-22T07:08:18+00:00,sintadwif02,Coretax knp nihh min ??? Ga kelar2 kerjaannya,1,https://www.instagram.com/pajakbadsel/reel/DOxJksiE3nW/,https://www.instagram.com/pajakbadsel/reel/DOxJksiE3nW/?comment_id=18073108325123393
17915982111054257,2025-09-22T07:06:42+00:00,brandonyo_07,Dehhhhh pegel nungguin coretax bisa di akses 🥱,1,https://www.instagram.com/pajakbadsel/reel/DOxJksiE3nW/,https://www.instagram.com/pajakbadsel/reel/DOxJksiE3nW/?comment_id=17915982111054257
18074294780118995,2025-09-22T07:04:22+00:00,tsaniyahm,down time kok gaada info nyaa😭,1,https://www.instagram.com/pajakbadsel/reel/DOxJksiE3nW/,https://www.instagram.com/pajakbadsel/reel/DOxJksiE3nW/?comment_id=18074294780118995
18328381093231963,2025-09-22T07:04:15+00:00,otodidac_,"Pak menteri @purbayayudhi_official bisa kali ini di cek,,,,dari Minggu lalu bermasalah,,,😢😢",2,https://www.instagram.com/pajakbadsel/reel/DOxJksiE3nW/,https://www.instagram.com/pajakbadsel/reel/DOxJksiE3nW/?comment_id=18328381093231963
18311618665170405,2025-09-22T07:02:43+00:00,debyfebb,Aduhhhhh itu maintenance kagak selesai2 dah,0,https://www.instagram.com/pajakbadsel/reel/DOxJksiE3nW/,https://www.instagram.com/pajakbadsel/reel/DOxJksiE3nW/?comment_id=18311618665170405
18199906741310793,2025-09-22T07:00:59+00:00,irma.meinila,14.00 ~dont let me down~ NGAPAINNN SIIIHHHHHH,0,https://www.instagram.com/pajakbadsel/reel/DOxJksiE3nW/,https://www.instagram.com/pajakbadsel/reel/DOxJksiE3nW/?comment_id=18199906741310793
17968708229957377,2025-09-22T07:00:04+00:00,julliii____,🥱,0,https://www.instagram.com/pajakbadsel/reel/DOxJksiE3nW/,https://www.instagram.com/pajakbadsel/reel/DOxJksiE3nW/?comment_id=17968708229957377
18111252304547785,2025-09-22T06:59:36+00:00,ardillasuardi97,Maintenance lagi situa busuk ini ??? Ampun,0,https://www.instagram.com/pajakbadsel/reel/DOxJksiE3nW/,https://www.instagram.com/pajakbadsel/reel/DOxJksiE3nW/?comment_id=18111252304547785
18046591178650300,2025-09-22T06:58:04+00:00,revo_dian,"downtime coretax gaiss, sehabis maksi",0,https://www.instagram.com/pajakbadsel/reel/DOxJksiE3nW/,https://www.instagram.com/pajakbadsel/reel/DOxJksiE3nW/?comment_id=18046591178650300
18090006514694345,2025-09-22T06:55:35+00:00,namibee51,Ini sampai kapan downtime???? Ya ditulis gitu kek,0,https://www.instagram.com/pajakbadsel/reel/DOxJksiE3nW/,https://www.instagram.com/pajakbadsel/reel/DOxJksiE3nW/?comment_id=18090006514694345
18306530656223560,2025-09-22T06:55:28+00:00,chacasthetic,downtime 2 hari ga cukup kah???? Semua jadi susah perkara coretax ini😢,0,https://www.instagram.com/pajakbadsel/reel/DOxJksiE3nW/,https://www.instagram.com/pajakbadsel/reel/DOxJksiE3nW/?comment_id=18306530656223560
18093520180752311,2025-09-22T06:54:53+00:00,tiwayshzz,Makin hari makin kocak,1,https://www.instagram.com/pajakbadsel/reel/DOxJksiE3nW/,https://www.instagram.com/pajakbadsel/reel/DOxJksiE3nW/?comment_id=18093520180752311
17882791038263608,2025-09-22T06:54:53+00:00,wldmaya,Astagfiruhlah kenapa ya coretax gak selesai” ampun mau tagihan lohhh gak selesai” rawat jalan . Tolong lah dibantu pak @prabowo @gibran_rakabuming @rizky_irmansyah  @gerindra mentri udah ganti baru kan . Masa aplikasi msh gak jalan 😭😭😭😭 @menkeuri,0,https://www.instagram.com/pajakbadsel/reel/DOxJksiE3nW/,https://www.instagram.com/pajakbadsel/reel/DOxJksiE3nW/?comment_id=17882791038263608
17933709783094978,2025-09-22T06:52:55+00:00,fajriahasmara,Minnn kenapaa hari seninn siiii🫵😭,0,https://www.instagram.com/pajakbadsel/reel/DOxJksiE3nW/,https://www.instagram.com/pajakbadsel/reel/DOxJksiE3nW/?comment_id=17933709783094978
18404782858136085,2025-09-22T06:52:26+00:00,bagusje,"Coretax down !!, nurul temen saya ga kerja nih !!!",1,https://www.instagram.com/pajakbadsel/reel/DOxJksiE3nW/,https://www.instagram.com/pajakbadsel/reel/DOxJksiE3nW/?comment_id=18404782858136085
18010168295619716,2025-09-22T06:52:24+00:00,titaindriana,Min.. coretax lg down ya? Td sebelum jam 1 masih bisa,1,https://www.instagram.com/pajakbadsel/reel/DOxJksiE3nW/,https://www.instagram.com/pajakbadsel/reel/DOxJksiE3nW/?comment_id=18010168295619716
18530660071030411,2025-09-22T06:52:17+00:00,nur_siyam,Tidak cukup downtime Sabtu - Minggu? Masa sekarang downtime lagi? Tadi pagi padahal bisa login.,0,https://www.instagram.com/pajakbadsel/reel/DOxJksiE3nW/,https://www.instagram.com/pajakbadsel/reel/DOxJksiE3nW/?comment_id=18530660071030411
18129926533415277,2025-09-22T06:52:13+00:00,seraallday,Sampai kapan gak bisa diakses ini ya?,0,https://www.instagram.com/pajakbadsel/reel/DOxJksiE3nW/,https://www.instagram.com/pajakbadsel/reel/DOxJksiE3nW/?comment_id=18129926533415277
17879509806286250,2025-09-22T06:51:36+00:00,tommmmmyyyyyy_,,1,https://www.instagram.com/pajakbadsel/reel/DOxJksiE3nW/,https://www.instagram.com/pajakbadsel/reel/DOxJksiE3nW/?comment_id=17879509806286250
18109276465494418,2025-09-22T06:51:22+00:00,nurulmuslimah12,"Coretax tidak bisa dibuka lagi , hadehhhh",0,https://www.instagram.com/pajakbadsel/reel/DOxJksiE3nW/,https://www.instagram.com/pajakbadsel/reel/DOxJksiE3nW/?comment_id=18109276465494418
18011123594789621,2025-09-22T06:50:34+00:00,diecastbrother,Situs lu down kata sampe 21 tapi ini udah 23 ajg,0,https://www.instagram.com/pajakbadsel/reel/DOxJksiE3nW/,https://www.instagram.com/pajakbadsel/reel/DOxJksiE3nW/?comment_id=18011123594789621
17925457344126712,2025-09-22T06:50:27+00:00,nsunaenah,Astagfirullah 😢😢,0,https://www.instagram.com/pajakbadsel/reel/DOxJksiE3nW/,https://www.instagram.com/pajakbadsel/reel/DOxJksiE3nW/?comment_id=17925457344126712
18091534426684540,2025-09-22T06:49:19+00:00,duwiprastiwi,CT lagi down time.. . Moga cepat bisa akses.. Uda ngerjain pegawai swasta.,0,https://www.instagram.com/pajakbadsel/reel/DOxJksiE3nW/,https://www.instagram.com/pajakbadsel/reel/DOxJksiE3nW/?comment_id=18091534426684540
18102031375533552,2025-09-22T06:49:06+00:00,nrtaaa12,Pak tolong pak @menkeuri  cekk coretax pak,0,https://www.instagram.com/pajakbadsel/reel/DOxJksiE3nW/,https://www.instagram.com/pajakbadsel/reel/DOxJksiE3nW/?comment_id=18102031375533552
17862693348471157,2025-09-22T06:49:00+00:00,l1mton,Emang kagak pernah beres coretax kalian ini,0,https://www.instagram.com/pajakbadsel/reel/DOxJksiE3nW/,https://www.instagram.com/pajakbadsel/reel/DOxJksiE3nW/?comment_id=17862693348471157
18002954150812637,2025-09-22T06:48:39+00:00,shindydinsy,"Haiaaaaaiaaaaaa tiba tiba notifnya ""Pemeliharaan Coretax DJP""",0,https://www.instagram.com/pajakbadsel/reel/DOxJksiE3nW/,https://www.instagram.com/pajakbadsel/reel/DOxJksiE3nW/?comment_id=18002954150812637
17987474333712185,2025-09-22T06:47:52+00:00,anakikoki,Lha ko malah down time sih. Ni hari senin woy kerjaan numpuk. Kemarin sabtu minggu kanndah down time. Gimana sih,1,https://www.instagram.com/pajakbadsel/reel/DOxJksiE3nW/,https://www.instagram.com/pajakbadsel/reel/DOxJksiE3nW/?comment_id=17987474333712185
18144496576424104,2025-09-22T06:46:57+00:00,dswarsanas,Min coretax kapan bisa diakses? 😞,1,https://www.instagram.com/pajakbadsel/reel/DOxJksiE3nW/,https://www.instagram.com/pajakbadsel/reel/DOxJksiE3nW/?comment_id=18144496576424104
18411546841115958,2025-09-22T06:46:55+00:00,judgefarler,HALOOOO DOWNTIME KAPAN BERESNYA???,1,https://www.instagram.com/pajakbadsel/reel/DOxJksiE3nW/,https://www.instagram.com/pajakbadsel/reel/DOxJksiE3nW/?comment_id=18411546841115958
18511535548067445,2025-09-22T06:46:25+00:00,qamaradi_007,ngapunten bukannya kmrin downtime kok skrng masi downtime lgi ?,1,https://www.instagram.com/pajakbadsel/reel/DOxJksiE3nW/,https://www.instagram.com/pajakbadsel/reel/DOxJksiE3nW/?comment_id=18511535548067445
18113394070473499,2025-09-22T06:46:22+00:00,shofiah_inayati,"Ya allah coretaax kenapa lagi ini, kenapa ganti menteri errornya makin makin sering ya. Capek, saya mau kerja",0,https://www.instagram.com/pajakbadsel/reel/DOxJksiE3nW/,https://www.instagram.com/pajakbadsel/reel/DOxJksiE3nW/?comment_id=18113394070473499
17882610015262883,2025-09-22T06:46:11+00:00,mitadmy_,"TOLONG AUDIT @kemenkeuri SI CORETAX INI, DARI AWAL TAHUN SAMPE MAU AKHIR TAHUN MASIH BANYAKAN ERROR NYA HERAN",0,https://www.instagram.com/pajakbadsel/reel/DOxJksiE3nW/,https://www.instagram.com/pajakbadsel/reel/DOxJksiE3nW/?comment_id=17882610015262883
18091512427774707,2025-09-22T06:45:21+00:00,liinst26,Masih downtime 😌,0,https://www.instagram.com/pajakbadsel/reel/DOxJksiE3nW/,https://www.instagram.com/pajakbadsel/reel/DOxJksiE3nW/?comment_id=18091512427774707
18077273924005226,2025-09-22T06:44:25+00:00,nrtaaa12,"Kacaw sekali sistem sering eror tolong perbaiki jangan nyusahin rakyat, rakyat udah susah jdi serba susah",0,https://www.instagram.com/pajakbadsel/reel/DOxJksiE3nW/,https://www.instagram.com/pajakbadsel/reel/DOxJksiE3nW/?comment_id=18077273924005226
17861335329427397,2025-09-22T06:44:23+00:00,namibee51,Boleh mengumpat di kolom komentar gak sih?,0,https://www.instagram.com/pajakbadsel/reel/DOxJksiE3nW/,https://www.instagram.com/pajakbadsel/reel/DOxJksiE3nW/?comment_id=17861335329427397
18142262155427357,2025-09-22T06:44:10+00:00,me_penny,Terpantau masih downtime :(,0,https://www.instagram.com/pajakbadsel/reel/DOxJksiE3nW/,https://www.instagram.com/pajakbadsel/reel/DOxJksiE3nW/?comment_id=18142262155427357
17883187998380229,2025-09-22T06:43:53+00:00,mooo.ly,"adminn, siang ini downtime kah min??",0,https://www.instagram.com/pajakbadsel/reel/DOxJksiE3nW/,https://www.instagram.com/pajakbadsel/reel/DOxJksiE3nW/?comment_id=17883187998380229
18079462627950995,2025-09-22T06:43:34+00:00,deeeeyyyaaa,Tolong dah udah tanggal 22 masih error piye toh ikiiiiii ? Terhambat pekerjaan gara gara sistem begini 🥲,0,https://www.instagram.com/pajakbadsel/reel/DOxJksiE3nW/,https://www.instagram.com/pajakbadsel/reel/DOxJksiE3nW/?comment_id=18079462627950995
18037049327694461,2025-09-22T06:43:31+00:00,namibee51,Downtime terossssssssssss,0,https://www.instagram.com/pajakbadsel/reel/DOxJksiE3nW/,https://www.instagram.com/pajakbadsel/reel/DOxJksiE3nW/?comment_id=18037049327694461
18056195846185336,2025-09-22T06:43:27+00:00,nadne.d,Masih belum bisa kah coretaxnya?,0,https://www.instagram.com/pajakbadsel/reel/DOxJksiE3nW/,https://www.instagram.com/pajakbadsel/reel/DOxJksiE3nW/?comment_id=18056195846185336
18040741700429167,2025-09-22T06:42:28+00:00,amara_elchehbani,"coretax mu eror lagi kan? putih bersih kek tanpa dosa ku buka hari ini 😂😂 sampe ku tak bisa berword word , ya ampuuunnnnn gusttiiiiiiiiiiiiiiiiiiiiiii",0,https://www.instagram.com/pajakbadsel/reel/DOxJksiE3nW/,https://www.instagram.com/pajakbadsel/reel/DOxJksiE3nW/?comment_id=18040741700429167
18086330626862848,2025-09-22T06:42:25+00:00,junedsptr,"Coretax masih gabisa, ganggu aktivitas niih😢",0,https://www.instagram.com/pajakbadsel/reel/DOxJksiE3nW/,https://www.instagram.com/pajakbadsel/reel/DOxJksiE3nW/?comment_id=18086330626862848
18054459416215435,2025-09-22T06:42:14+00:00,el_khairull,Kok masih Downtime sihh,1,https://www.instagram.com/pajakbadsel/reel/DOxJksiE3nW/,https://www.instagram.com/pajakbadsel/reel/DOxJksiE3nW/?comment_id=18054459416215435
17897828295292449,2025-09-22T06:41:04+00:00,duwiprastiwi,CT error dr Januari ini bulan k 9.. masih gini.2.. ppic CT kagak da tanggung jawab..,0,https://www.instagram.com/pajakbadsel/reel/DOxJksiE3nW/,https://www.instagram.com/pajakbadsel/reel/DOxJksiE3nW/?comment_id=17897828295292449
17864695266396487,2025-09-22T06:40:21+00:00,dengrhaa,WOYYY MAU LOGIN DJP SUSAH BANGET KAYAKNYA NGIRIM KODE VERIFIKASI ??? HARUS BERAPA KALI VERIFIKASI HAH ???,0,https://www.instagram.com/pajakbadsel/reel/DOxJksiE3nW/,https://www.instagram.com/pajakbadsel/reel/DOxJksiE3nW/?comment_id=17864695266396487
18043656179682729,2025-09-22T06:40:17+00:00,sintamaimanah,Downtimenya sampe senin ya?,0,https://www.instagram.com/pajakbadsel/reel/DOxJksiE3nW/,https://www.instagram.com/pajakbadsel/reel/DOxJksiE3nW/?comment_id=18043656179682729
18074872079025661,2025-09-22T06:39:30+00:00,selaiia_,Ini kenapa ga bisa login coretax yaa,0,https://www.instagram.com/pajakbadsel/reel/DOxJksiE3nW/,https://www.instagram.com/pajakbadsel/reel/DOxJksiE3nW/?comment_id=18074872079025661
18079091311976410,2025-09-22T06:37:25+00:00,rafida.devi26,13:36 coretax An erorr occurred 😢,1,https://www.instagram.com/pajakbadsel/reel/DOxJksiE3nW/,https://www.instagram.com/pajakbadsel/reel/DOxJksiE3nW/?comment_id=18079091311976410
18127782718466229,2025-09-22T06:36:06+00:00,duwiprastiwi,CT web kagak bisa di akses... Gimana da satu jam web kagak bisa diakses.,3,https://www.instagram.com/pajakbadsel/reel/DOxJksiE3nW/,https://www.instagram.com/pajakbadsel/reel/DOxJksiE3nW/?comment_id=18127782718466229
17871149883353106,2025-09-22T06:32:10+00:00,theonlyzvn_,"mohonnn secepat nyaaa di perbaikiiii min plisss ,kerjaan jd terhambatt karena server ga bisa di akses sama sekaliiii😢",2,https://www.instagram.com/pajakbadsel/reel/DOxJksiE3nW/,https://www.instagram.com/pajakbadsel/reel/DOxJksiE3nW/?comment_id=17871149883353106
18081946870931178,2025-09-22T06:30:27+00:00,mitadmy_,"Mau nya apa si ini, udh sabtu minggu downtime, sekarang masuk coretax pun ga bisa",16,https://www.instagram.com/pajakbadsel/reel/DOxJksiE3nW/,https://www.instagram.com/pajakbadsel/reel/DOxJksiE3nW/?comment_id=18081946870931178
18329133511224426,2025-09-22T06:29:35+00:00,cattleyaputri,Kok error ya,2,https://www.instagram.com/pajakbadsel/reel/DOxJksiE3nW/,https://www.instagram.com/pajakbadsel/reel/DOxJksiE3nW/?comment_id=18329133511224426
18022715669769335,2025-09-22T06:29:23+00:00,namibee51,3:28 PM WIT An Error Occurred,6,https://www.instagram.com/pajakbadsel/reel/DOxJksiE3nW/,https://www.instagram.com/pajakbadsel/reel/DOxJksiE3nW/?comment_id=18022715669769335
18069261212517154,2025-09-22T06:28:25+00:00,theonlyzvn_,sampe sekarang blm bisa di akses coretax nya😢😢,2,https://www.instagram.com/pajakbadsel/reel/DOxJksiE3nW/,https://www.instagram.com/pajakbadsel/reel/DOxJksiE3nW/?comment_id=18069261212517154
18101573626528805,2025-09-22T06:28:23+00:00,theonlypiiiiii,😢😢 loading terus gamasuk masuk,4,https://www.instagram.com/pajakbadsel/reel/DOxJksiE3nW/,https://www.instagram.com/pajakbadsel/reel/DOxJksiE3nW/?comment_id=18101573626528805
17984680142883370,2025-09-22T06:27:49+00:00,theonlyzvn_,"tolong bantu min ,server nya down gak bisa di buka terusss",4,https://www.instagram.com/pajakbadsel/reel/DOxJksiE3nW/,https://www.instagram.com/pajakbadsel/reel/DOxJksiE3nW/?comment_id=17984680142883370
18053262872623209,2025-09-22T06:25:30+00:00,dea.elisa,"Tolong min dibantu, sistemnya down terus",3,https://www.instagram.com/pajakbadsel/reel/DOxJksiE3nW/,https://www.instagram.com/pajakbadsel/reel/DOxJksiE3nW/?comment_id=18053262872623209
