id,timestamp,ownerUsername,text,likesCount,postUrl,commentUrl
18060746738579646,2025-09-05T04:22:00+00:00,hanny_ipech,Maaf mo nanya ya min akuu kena masa denda ritl bpjs dari bulan agustus tanggal 10 2025 sampe tanggal 24 september seharusnya yaa tapi koq kenapa malah diperpanjang masa denda nya jadi tanggal 2 september sampe 17 oktober 😢😢😭padahal udh mao kelar min masa denda nya dibulan ini di bulan september 2025 tanggal 24 mohon diupgrade ya minn akun bpjs kami soalnya saya mao ada jadwal caesar di bulan oktober😢😢😢,0,https://www.instagram.com/bpjskesehatan_ri/p/DOLfw2uDYgD/,https://www.instagram.com/bpjskesehatan_ri/p/DOLfw2uDYgD/?comment_id=18060746738579646
18096729628574708,2025-09-05T03:46:50+00:00,winda_arkhan,KK mau tanya kalau kita pakai BPJS untuk tambal gigi depan itu di tanggung ngak ya,0,https://www.instagram.com/bpjskesehatan_ri/p/DOLfw2uDYgD/,https://www.instagram.com/bpjskesehatan_ri/p/DOLfw2uDYgD/?comment_id=18096729628574708
17923938099107520,2025-09-05T03:24:04+00:00,cindy_sutiaraa,"Anak saya usia 4th terdaftar sebagai peserta PBPU DAN BP
Pihak kelurahan memberikan arahan utk membuat akun terpisah.
Tapi pada saat membuat akun diwajibkan verifikasi muka , itu membutuhkan waktu berulang utk bisa masuk dan hingga kini blm bisa terdaftar.
Tolong jangan mempersulit warga yang ingin berobat.
Kalau kondisi nya urgent bagaimana??
Hapuskan fitur verifikasi muka karena tidak efektif",0,https://www.instagram.com/bpjskesehatan_ri/p/DOLfw2uDYgD/,https://www.instagram.com/bpjskesehatan_ri/p/DOLfw2uDYgD/?comment_id=17923938099107520
18384191590121952,2025-09-05T03:02:21+00:00,rosaindah17_,"Hallo admin.. mau nanya kalau status peserta bpjs nya ""tidak aktif - penangguhan pembayaran"" itu knp ya min ? Padahal pas dicek pembayaran nya udh lunas.",0,https://www.instagram.com/bpjskesehatan_ri/p/DOLfw2uDYgD/,https://www.instagram.com/bpjskesehatan_ri/p/DOLfw2uDYgD/?comment_id=18384191590121952
18318076867245925,2025-09-05T02:50:19+00:00,bambapalamba17,🔥🔥🔥,0,https://www.instagram.com/bpjskesehatan_ri/p/DOLfw2uDYgD/,https://www.instagram.com/bpjskesehatan_ri/p/DOLfw2uDYgD/?comment_id=18318076867245925
18041601539689221,2025-09-05T02:39:22+00:00,sarahsena97,"Mohon jangan di persulit ka untuk verifikasi wajah , karna kasian kalo yang lagi sakit banget atau anak kecil banget misal bayi masa verifikasi harus tetep muka mereka , semoga ada lagi verifikasi gagal terus klik lewati langsung verifikasi no hp atau email 🙏",0,https://www.instagram.com/bpjskesehatan_ri/p/DOLfw2uDYgD/,https://www.instagram.com/bpjskesehatan_ri/p/DOLfw2uDYgD/?comment_id=18041601539689221
18037824392682564,2025-09-05T01:41:36+00:00,abcanopus,"Min, kalau udah daftar akun tapi no hp sama email belum terdaftar tapi lupa password gimana?",0,https://www.instagram.com/bpjskesehatan_ri/p/DOLfw2uDYgD/,https://www.instagram.com/bpjskesehatan_ri/p/DOLfw2uDYgD/?comment_id=18037824392682564
18067982327221367,2025-09-05T00:28:17+00:00,eko_fahma,"belum ada solusi utk hp seri oppo A71, tidak bis didownload tidak muncul di play store dulu bisa awalnya tapi diperbaharui malah sekarang ga bisa tidak kompatible dg oppoA71",0,https://www.instagram.com/bpjskesehatan_ri/p/DOLfw2uDYgD/,https://www.instagram.com/bpjskesehatan_ri/p/DOLfw2uDYgD/?comment_id=18067982327221367
18103446292575954,2025-09-05T00:14:06+00:00,fitrianirustandi,"Min @bpjskesehatan_ri ibu saya sakit gulanya tinggi, begitu datang ke ugd, kenapa tidak bisa dipakai bpjsnya? Malah harus bayar normal, sebelum-sebelumnya bisa dipakai, di rawat pun harus bayar normal, itu kenapa min?",0,https://www.instagram.com/bpjskesehatan_ri/p/DOLfw2uDYgD/,https://www.instagram.com/bpjskesehatan_ri/p/DOLfw2uDYgD/?comment_id=18103446292575954
18132674533450145,2025-09-05T00:10:49+00:00,_ed.md_,"Maaf mau tanya, setiap kali saya mau ambil no antrian di mobile jkn, selalu tidak bisa karena selalu muncul tulisan ini ""terjadi kegagalan saat proses penyimpanan data"" .. saya sudah restart hp bahkan sudah uninstall dan instal lagi tapi kendala yang sama terus muncul... Mohon infonya ya karena sabtu depan saya harus kontrol kembali dan ambil no antrian belum bisa sampai  sekarang..",0,https://www.instagram.com/bpjskesehatan_ri/p/DOLfw2uDYgD/,https://www.instagram.com/bpjskesehatan_ri/p/DOLfw2uDYgD/?comment_id=18132674533450145
17978837870911722,2025-09-05T00:08:42+00:00,rreisch4,pagi min... bagaimana cara menambah anggota baru bpjs kiss? mohon bantuan nya,0,https://www.instagram.com/bpjskesehatan_ri/p/DOLfw2uDYgD/,https://www.instagram.com/bpjskesehatan_ri/p/DOLfw2uDYgD/?comment_id=17978837870911722
17874900930409235,2025-09-04T22:32:29+00:00,ishowmeows,Min tolong balas dm saya ya terima kasih,0,https://www.instagram.com/bpjskesehatan_ri/p/DOLfw2uDYgD/,https://www.instagram.com/bpjskesehatan_ri/p/DOLfw2uDYgD/?comment_id=17874900930409235
17842408758573013,2025-09-04T22:23:58+00:00,whieas31,🔥🔥,0,https://www.instagram.com/bpjskesehatan_ri/p/DOLfw2uDYgD/,https://www.instagram.com/bpjskesehatan_ri/p/DOLfw2uDYgD/?comment_id=17842408758573013
18262025992303878,2025-09-04T17:37:19+00:00,rsmly.__,"Min, katanya ada peraturan baru bahwa bpjs tidak dapat digunakan kalau belum skrining kesehatan ya? Trus skriningnya lewat aplikasi gitu?",0,https://www.instagram.com/bpjskesehatan_ri/p/DOLfw2uDYgD/,https://www.instagram.com/bpjskesehatan_ri/p/DOLfw2uDYgD/?comment_id=18262025992303878
18090012946744336,2025-09-04T16:23:30+00:00,_jmwindah,"Hallo min, mau tanya. Kalau perbarui data anggota di bpjs apakah bisa lewat online atau harus langsung datang ke kantor bpjs ? Kalau datang ke kantor, apakah ktp bisa memakai resi karena saat ini ktp sedang di perbarui alamatnya. Lalu untuk iuran bulan ini anggota yang ingin dikeluarkan apakah harus di bayar atau bisa langsung diproses pengeluaran dari data bpjs ?",0,https://www.instagram.com/bpjskesehatan_ri/p/DOLfw2uDYgD/,https://www.instagram.com/bpjskesehatan_ri/p/DOLfw2uDYgD/?comment_id=18090012946744336
18043047131355358,2025-09-04T16:19:21+00:00,muteesibilno,"Suami saya pemegang KIS, berobat di @rsiaisyiyahmalang masih ttp disuruh bayar, kondisi  ud kesakitan ...apa gunanya punya KIS...apa harus mau MATI dulu bari bisa gratis....😢😢...@fraksipartaigerindra  kondisi ekonomi lagi sulit berharap berobat dengan kis supaya gratis...tolonglah kebijakan ini menyusahkan rakyat kecilll",0,https://www.instagram.com/bpjskesehatan_ri/p/DOLfw2uDYgD/,https://www.instagram.com/bpjskesehatan_ri/p/DOLfw2uDYgD/?comment_id=18043047131355358
18071195486128503,2025-09-04T15:12:08+00:00,rianty2303,"10 tahun lebih pakai BPJS, digunakan sekali untuk tambal gigi, tp prosesnya lama sampai 2 rumah sakit tujuannya pasti taukan, trus pakai yg ke 2 utk sakit mata dan dikasih bntuan utk kaca mata 220, dikirain masalah selesai. Setelah ke optik kena seperti awal saya tanya klu kls 2 330k, kenyataan kena 430 dg  BPJS 220 🔥 percuma pakai BPJS mending ngak usah bayar",0,https://www.instagram.com/bpjskesehatan_ri/p/DOLfw2uDYgD/,https://www.instagram.com/bpjskesehatan_ri/p/DOLfw2uDYgD/?comment_id=18071195486128503
18102637444585506,2025-09-04T15:05:35+00:00,femiferi,"Mau tanya dong, katanya kita suruh mengisi skrining kesehatan, tp ternyata skrining kesehatan kita sudah terisi, dan tiba-tiba hasil akhir nya kita terdeteksi penyakit yg menyeramkan, dari mana itu hasil skrining bisa nongol, dan data penyakit menyeramkan itu dr mana asalnya",0,https://www.instagram.com/bpjskesehatan_ri/p/DOLfw2uDYgD/,https://www.instagram.com/bpjskesehatan_ri/p/DOLfw2uDYgD/?comment_id=18102637444585506
18073372136154086,2025-09-04T15:04:02+00:00,rsilviani,"Min....saya di telp org yg ngaku petugas bpjs, katanya ada akun salah satu anak saya yang belum di verifikasi....d suruh verifikasi melalui aplikasi  mobile jkn, saya cek d mobile jkn aktif kok akun anak saya itu... apa mmg ada petugas bpjs yang nelpkn seperti itu min...???",0,https://www.instagram.com/bpjskesehatan_ri/p/DOLfw2uDYgD/,https://www.instagram.com/bpjskesehatan_ri/p/DOLfw2uDYgD/?comment_id=18073372136154086
17914499463054409,2025-09-04T14:51:17+00:00,riri_munandar_130219,Sekarang bpjs misal mau pindah faskes harus bayar ya,0,https://www.instagram.com/bpjskesehatan_ri/p/DOLfw2uDYgD/,https://www.instagram.com/bpjskesehatan_ri/p/DOLfw2uDYgD/?comment_id=17914499463054409
18341496748166504,2025-09-04T14:01:15+00:00,nata_hidaya,Min kenapa skrg BPJS gak bisa dibuat untuk semua penyakit? Kan kasian masyarakat yg gak mampu.,0,https://www.instagram.com/bpjskesehatan_ri/p/DOLfw2uDYgD/,https://www.instagram.com/bpjskesehatan_ri/p/DOLfw2uDYgD/?comment_id=18341496748166504
17992589846688466,2025-09-04T14:00:24+00:00,hellohiexma,pas mau ceck in kmrin baru kejadin pas mau kontrol bulanan barcode nya sudh d scan tp ga bs2 kirain knp gtu kan rupanya hp q yg kentang pas pindah hp 1 lg lgsung bs 😭 maaaaalu banget sma ptugas nya 😂,0,https://www.instagram.com/bpjskesehatan_ri/p/DOLfw2uDYgD/,https://www.instagram.com/bpjskesehatan_ri/p/DOLfw2uDYgD/?comment_id=17992589846688466
18068699621184114,2025-09-04T13:45:52+00:00,aisaharsyah,Min.. ko bpjs daerah saya pakai sistem zonasi yah.. saya tinggal disubang ga bisa minta rujukan ke karawang padahal rumah dan faskes saya lebih dekat ke rs daerah karawang. Sungguh sedih sekali,0,https://www.instagram.com/bpjskesehatan_ri/p/DOLfw2uDYgD/,https://www.instagram.com/bpjskesehatan_ri/p/DOLfw2uDYgD/?comment_id=18068699621184114
18051321767258757,2025-09-04T13:33:44+00:00,kintana_agustin,Min besok kan tgl merah kantor BPJS Soreang besok buka/ tutup,0,https://www.instagram.com/bpjskesehatan_ri/p/DOLfw2uDYgD/,https://www.instagram.com/bpjskesehatan_ri/p/DOLfw2uDYgD/?comment_id=18051321767258757
18078509167800226,2025-09-04T13:08:11+00:00,stefgrmb,Tlong balas dm saya min,0,https://www.instagram.com/bpjskesehatan_ri/p/DOLfw2uDYgD/,https://www.instagram.com/bpjskesehatan_ri/p/DOLfw2uDYgD/?comment_id=18078509167800226
17863202793393782,2025-09-04T12:49:01+00:00,y_a_toro,"ambil antrian dari aplikasi tidak bisa nyampek diurut perbulan juga gk bisa, padahal sudah dikasih rujukan dari faskes 1 gitu solusi nyatanya bagaimna?",0,https://www.instagram.com/bpjskesehatan_ri/p/DOLfw2uDYgD/,https://www.instagram.com/bpjskesehatan_ri/p/DOLfw2uDYgD/?comment_id=17863202793393782
17875224204310962,2025-09-04T12:37:38+00:00,xvmtmx,"Selamat malam admin. Saya mau bertanya. Ibu saya dulu punya BPJS kesehatan ikut dengan suaminya yg kerja di sebuah PT. Tapi sekarang ibu saya sudah bercerai dengan suaminya, dan BPJS nya sudah tidak ikut dengan suaminya lagi. Yg ingin saya tanyakan, jika ibu saya ingin mengaktifkan kartu BPJS nya lagi, apakah akan ada denda atau tidak? Soalnya sudah lama belum di urus",0,https://www.instagram.com/bpjskesehatan_ri/p/DOLfw2uDYgD/,https://www.instagram.com/bpjskesehatan_ri/p/DOLfw2uDYgD/?comment_id=17875224204310962
18522266623035469,2025-09-04T12:32:18+00:00,suhardiman9,"Selamat malam admin mau tanya anak saya ada benjolan mukokel di mulut,apa bisa berobat operasi pake bpjs kesehatan saya sudah ke puskesmas kok katanya tidak bisa yah",0,https://www.instagram.com/bpjskesehatan_ri/p/DOLfw2uDYgD/,https://www.instagram.com/bpjskesehatan_ri/p/DOLfw2uDYgD/?comment_id=18522266623035469
18114533062518912,2025-09-04T12:09:30+00:00,monaaz94,klw no hp di blokir pandawa gimana min?,1,https://www.instagram.com/bpjskesehatan_ri/p/DOLfw2uDYgD/,https://www.instagram.com/bpjskesehatan_ri/p/DOLfw2uDYgD/?comment_id=18114533062518912
18043177058355577,2025-09-04T17:00:14+00:00,pejalan_j,"Hari ini dari Puskesmas dirujuk ke IGD karena nyeri hebat, pas sampe di RS malah disuruh balik ke Puskesmas karena ga ada kegawatdaruratan. Ini tuh konsep nya gimana",2,https://www.instagram.com/bpjskesehatan_ri/reel/DOFuU_ngZ13/,https://www.instagram.com/bpjskesehatan_ri/reel/DOFuU_ngZ13/?comment_id=18043177058355577
18149135290396628,2025-09-03T08:51:03+00:00,ahmad.mlm7,Mudah? Fakta di rumah sakit beda,1,https://www.instagram.com/bpjskesehatan_ri/reel/DOFuU_ngZ13/,https://www.instagram.com/bpjskesehatan_ri/reel/DOFuU_ngZ13/?comment_id=18149135290396628
18030050207512160,2025-09-22T13:04:58+00:00,siti.ianah.71,Cara bikin BPJS gmn,0,https://www.instagram.com/bpjskesehatan_ri/reel/DOFuU_ngZ13/,https://www.instagram.com/bpjskesehatan_ri/reel/DOFuU_ngZ13/?comment_id=18030050207512160
18094837261725162,2025-09-02T12:29:31+00:00,siskawayn,Min kenapa ini kok tiba2 tagihan kelas 3 tiap peserta 70.000 ya?? Padahal gk ada tunggakan,0,https://www.instagram.com/bpjskesehatan_ri/reel/DOFuU_ngZ13/,https://www.instagram.com/bpjskesehatan_ri/reel/DOFuU_ngZ13/?comment_id=18094837261725162
17952618659871999,2025-09-04T11:04:57+00:00,twinsbaby.house,"Mau mnta tolong, ponakan saya skr ada drumah sakit koja, harus transfusi darah, bpjsnya br bs aktif dtanggal 16, hr ini udh bayar 170rb utk cek darah dn bsok hrus amnil drah k pmi, mhon utk bs diaktifkan bpjsnya, supaya bisa dipakai utk pengobatan ponakan saya😢",0,https://www.instagram.com/bpjskesehatan_ri/reel/DOFuU_ngZ13/,https://www.instagram.com/bpjskesehatan_ri/reel/DOFuU_ngZ13/?comment_id=17952618659871999
17933612891962540,2025-09-02T15:55:37+00:00,irenebos0559,"Yakin melayani dengan hati,Pak.. Kalau melayani dengan hati,,seharusnya tidak banyak comment di Instagram.. Memang benar apa adanya Rawat Inap dengan biaya pribadi dengan BPJS itu beda kok pelayanannya,, Pakai biaya pribadi ataupun asuransi,harus sampai sembuh tapi kalau pakai BPJS masih tetap 3 hari buat ringan,yang berat tetap maksimal 7 hari",4,https://www.instagram.com/bpjskesehatan_ri/reel/DOFuU_ngZ13/,https://www.instagram.com/bpjskesehatan_ri/reel/DOFuU_ngZ13/?comment_id=17933612891962540
18024611156741518,2025-09-04T05:44:24+00:00,eljadenn,Turun lapangan dlu 😂,1,https://www.instagram.com/bpjskesehatan_ri/reel/DOFuU_ngZ13/,https://www.instagram.com/bpjskesehatan_ri/reel/DOFuU_ngZ13/?comment_id=18024611156741518
18086861062874137,2025-09-04T01:28:25+00:00,siti_aminah29,Cek dm min @bpjskesehatan_ri,0,https://www.instagram.com/bpjskesehatan_ri/reel/DOFuU_ngZ13/,https://www.instagram.com/bpjskesehatan_ri/reel/DOFuU_ngZ13/?comment_id=18086861062874137
18325736128236303,2025-09-04T18:52:29+00:00,naratama_yp,"@bpjskesehatan_ri  tolong donk di jelaskan untuk pasien yang datang ke UGD.  Apa harus ada. Kondisi khusus untuk bisa mengunakan BPJS / KIS .  Kenapa Pasian. Harus. Membaya mandiri untuk di rawat di UGD . Dan kis bisa di gunakan. Kalau Pasien benar"" di rawat . Aturan macam apa itu",1,https://www.instagram.com/bpjskesehatan_ri/reel/DOFuU_ngZ13/,https://www.instagram.com/bpjskesehatan_ri/reel/DOFuU_ngZ13/?comment_id=18325736128236303
17936833269074888,2025-09-02T12:15:08+00:00,dm.meliana,"Min tolong bantuannya urgent krna bapak saya pasien cuci darah rutin gabisa cuci hari ini. Jd kedua ortu sy, saya masukin jd keluarga tambahan lainnya, preminya dipotong 1% dari gaji sy dan profesi sy sebagai ASN Pusat. Tiba-tiba hari jumat minggu lalu dan hari ini bpjs bapak sy dinonaktifkan tanpa pemberitahuan sebelumnya.",0,https://www.instagram.com/bpjskesehatan_ri/reel/DOFuU_ngZ13/,https://www.instagram.com/bpjskesehatan_ri/reel/DOFuU_ngZ13/?comment_id=17936833269074888
18064307945202948,2025-09-02T22:46:28+00:00,wjndika,Iuran Bpjs naik ya ?,0,https://www.instagram.com/bpjskesehatan_ri/reel/DOFuU_ngZ13/,https://www.instagram.com/bpjskesehatan_ri/reel/DOFuU_ngZ13/?comment_id=18064307945202948
17906204475215205,2025-09-04T07:19:16+00:00,yenyuli13,"Hallo maf mau tanya BPJS punya orang tua sy status di JKNnya non aktif satu keluarga tidak terlindungi, tapi pas sy chat ke pandawa status BPJS punya orang tua sy aktif itu magsudnya gimna ya pengen aktif d JKNnya juga dan bisa di pake berobat",0,https://www.instagram.com/bpjskesehatan_ri/reel/DOFuU_ngZ13/,https://www.instagram.com/bpjskesehatan_ri/reel/DOFuU_ngZ13/?comment_id=17906204475215205
18102308578596362,2025-09-06T21:40:59+00:00,omajeannes,"lihat kenyataannya dong , msh banya RS yg hrs antri, nunggu dari pagi sampe sore/ kadang malam  baru dpt obat, ini kenyataan .",2,https://www.instagram.com/bpjskesehatan_ri/reel/DOFuU_ngZ13/,https://www.instagram.com/bpjskesehatan_ri/reel/DOFuU_ngZ13/?comment_id=18102308578596362
17863797588459672,2025-09-08T00:09:14+00:00,ollaya_photography,Rolong ini aspirasi admin kenapa utk persalinan ibu hamil jika tnpa penyulit tdk bisa diklaim bpjs. Kita sdh membayar rutin harusnya mau normal/sesar bisa cover bpjs,0,https://www.instagram.com/bpjskesehatan_ri/reel/DOFuU_ngZ13/,https://www.instagram.com/bpjskesehatan_ri/reel/DOFuU_ngZ13/?comment_id=17863797588459672
17970969416785521,2025-09-07T07:59:25+00:00,deisy_3011,Kalo mudah...mhn maaf admin tlg jelaskan KENAPA DENDA DIBAYAR PAS MAU DIRAWAT??? Ini Kendala bgt bt kami. Kdg kl urgent ke IGD trs dirawat ga persiapan bawa uang lbh Krn pikiran kita udh lunas BPJS. Sy termasuk yg sllu bayar rutin wlu kdg ga sesuai tgl. Masukan!! Bagaimana kl ada denda dibayarkan pas pembayaran Bulanan jd KL ke rmh sakit ga ada lg tagihan. Terus kedua...kebijakan siapa BPJS kah atau rmh sakit yg hrs dirawat tergantung indikasi penyakit dan ttp bayar umum cash kl ga ada indikasi utk dirawat? Mhn min @bpjskesehatan_ri dipertimbangkan masukan ini. Please. Krn dia mslh ini udh sy alami. Hrs terpaksa bingung pinjam uang org Krn dadakan dpt tagihan pas dirmh sakit🙏,0,https://www.instagram.com/bpjskesehatan_ri/reel/DOFuU_ngZ13/,https://www.instagram.com/bpjskesehatan_ri/reel/DOFuU_ngZ13/?comment_id=17970969416785521
18092533492747727,2025-09-24T23:49:14+00:00,lutfiramadhan45,🔥🔥,0,https://www.instagram.com/bpjskesehatan_ri/reel/DOFuU_ngZ13/,https://www.instagram.com/bpjskesehatan_ri/reel/DOFuU_ngZ13/?comment_id=18092533492747727
17940534287934822,2025-09-16T04:23:35+00:00,monalisa_calista,"Kok mau pakai bpjs masih tetap bayar ? Paskes masih terdaftar di jawa giliran pindah ke bali mau pakai bpjs , dan bpjs masih aktif kita sellu bayar perbulan masih tetap harus bayar ??????? Lalu guna nya bpjs apa ?",0,https://www.instagram.com/bpjskesehatan_ri/reel/DOFuU_ngZ13/,https://www.instagram.com/bpjskesehatan_ri/reel/DOFuU_ngZ13/?comment_id=17940534287934822
18328276696226948,2025-09-15T03:33:15+00:00,acemaxs.official,👍👍👍👍👍👍👍,0,https://www.instagram.com/bpjskesehatan_ri/reel/DOFuU_ngZ13/,https://www.instagram.com/bpjskesehatan_ri/reel/DOFuU_ngZ13/?comment_id=18328276696226948
17849913774552413,2025-09-12T05:01:19+00:00,ausarmunif,Bisa ga bikin BPJS mandiri bisa ga jangan  satu kk,0,https://www.instagram.com/bpjskesehatan_ri/reel/DOFuU_ngZ13/,https://www.instagram.com/bpjskesehatan_ri/reel/DOFuU_ngZ13/?comment_id=17849913774552413
18074833709025508,2025-09-10T11:18:46+00:00,ahmad_bayu_ajie,Mohon informasi kontak management bpjss yg responsif,0,https://www.instagram.com/bpjskesehatan_ri/reel/DOFuU_ngZ13/,https://www.instagram.com/bpjskesehatan_ri/reel/DOFuU_ngZ13/?comment_id=18074833709025508
18080478046764008,2025-09-10T06:31:32+00:00,adik.suharyanto,"Terkait persyaratan untuk kesehatan secara medis harusnya diutamakan keselamatan pasien ada kasus beberapa waktu lalu  tentang kelengkapan data pasien gak punya ktp gak jadi di tanganin , dan akhirnya meninggal saat bikin KTP menurut saya ini pelajaran semoga hal seperti kelengkapan data pasien itu no 2 tapi nyawa  no 1 penangannya.... Demi kemanusiaan 🔥🔥🔥",0,https://www.instagram.com/bpjskesehatan_ri/reel/DOFuU_ngZ13/,https://www.instagram.com/bpjskesehatan_ri/reel/DOFuU_ngZ13/?comment_id=18080478046764008
18110399341535996,2025-09-10T03:23:13+00:00,pejalan_j,@ali_ghufron_mukti punten,0,https://www.instagram.com/bpjskesehatan_ri/reel/DOFuU_ngZ13/,https://www.instagram.com/bpjskesehatan_ri/reel/DOFuU_ngZ13/?comment_id=18110399341535996
18123789868432445,2025-09-09T22:08:23+00:00,niniiiiiii37,@bpjskesehatan_ri benarkah biaya persalinan normal atau SC ga akan ditanggung BPJS apabila tidak ada riwayat periksa ANC di fakses 1,0,https://www.instagram.com/bpjskesehatan_ri/reel/DOFuU_ngZ13/,https://www.instagram.com/bpjskesehatan_ri/reel/DOFuU_ngZ13/?comment_id=18123789868432445
18053080349201844,2025-09-09T18:37:52+00:00,harmingchandra,"Itu teori pak bisa ktp untuk daftar, ternyata harus senior sidik jari,sensor wajah",0,https://www.instagram.com/bpjskesehatan_ri/reel/DOFuU_ngZ13/,https://www.instagram.com/bpjskesehatan_ri/reel/DOFuU_ngZ13/?comment_id=18053080349201844
17861478048415396,2025-09-09T18:28:52+00:00,harmingchandra,"Teorinya begitu, prakteknya beda pak.",0,https://www.instagram.com/bpjskesehatan_ri/reel/DOFuU_ngZ13/,https://www.instagram.com/bpjskesehatan_ri/reel/DOFuU_ngZ13/?comment_id=17861478048415396
17970525257940391,2025-09-09T12:53:10+00:00,thamrin9367,😂😂😂😂😂gue mah katawa ajah dah... liat pasien bpjs... karena bpjs ... yg punya aturan...,0,https://www.instagram.com/bpjskesehatan_ri/reel/DOFuU_ngZ13/,https://www.instagram.com/bpjskesehatan_ri/reel/DOFuU_ngZ13/?comment_id=17970525257940391
17993503838844581,2025-09-09T01:09:09+00:00,achutpriyanti,"Iya..BPJS gak menentukan hari rawat inap..TAPI BPJS MENETUKAN HRGA PAKET DI SETIAP DIAGNOSA.. jika haflrga paket penyakitnya habis otomatis pihak rumah sakit harus memulangkan pasien karena apa??karena yg akan tekor besar adalah rumah sakitnya.. bhp dan segala macam nya harus ngutang dlu .. dengan sekmen anda mengatakan BPJS tdk menentukan hari rawat itu sama saja dengan anda mengkambing hitamkan rumah sakit dan para nakes yg bekerja..
Nakes dan rumah sakit jadi bulan bulanan masyarakat.. dia anggap tdk becus merawat pasien..di katakan mal praktik dll..luar biasa skali dzalim nya kalian kepada orang orang yang bekerja menyelamatkan nyawa.. next mungkin yang perlu di demo adalah BPJS",0,https://www.instagram.com/bpjskesehatan_ri/reel/DOFuU_ngZ13/,https://www.instagram.com/bpjskesehatan_ri/reel/DOFuU_ngZ13/?comment_id=17993503838844581
18100073983540078,2025-09-08T04:48:42+00:00,bunda_henny67,"Slmt siang , Mohon maaf , Bunda mau komen ... Bunda punya pengalaman Pribadi ... Di Bln APRIL 2025 ... Bunda menemani KEL PASIEN ke IGD RSPA*  DI JAKARTA ... Keadaan PASIEN DINI HARI TDK BISA BANGUN DARI RANJANG ... DI GOTONG GUNAKAN MOBIL PRIBADI PASIEN ... Saat di IGD RSPA* tsb  berhubung PASIEN GUNAKAN BPJS ... oleh "" SUSTER "" BAGIAN PENDAFTARAN  DIKATAKAN "" KNP TDK PERGI KE RS TERDEKAT ? , INI RS TYPE A ? "" ... Bunda Jelaskan ... RS TERDEKAT RS SWASTA & RSUD YG BUNDA PERNAH ALAMI SENDIRI SAAT KE IGD RSUD YG DEHARUSNYA BISA GUNAKAN BPJS DI TOLAK PADAHAL DI SAAT YG BERSAMAAN BUNDA KE IGD RSPA*  TSB BUNDA BISA GUNAKAN BPJS , KRN ITU BUNDA LANGSUNG BAWA PASIEN KE IGD RSPA* ... untung DOKTER KOAS YG SEDANG JAGA PAGI HARI LANGSUNG PERIKSA , & AKHIRNYA BISA GUNAKAN BPJS UTK RAWAT INAP ... Saat di IGD RSPA*  PASIEN HARUS BUAT JANJI JIKA TDK DITANGGUNG BPJS MAKA HRS BAYAR ... Bunda lihat di IGD RSPA*  ADA SPANDUK PENGUMUMAN  DAFTAR  PENYAKIT YG TDK DITANGGUNG OLEH BPJS SAAT DI IGD ... INTINYA MENURUT BUNDA BPJS HANYA MAU MENANGGUNG PASIEN YG SAKRATUL MAUT ... Jadi untuk apa IURAN NAIK SEDANGKAN PASIEN DI PERSULIT ??? ... Bunda harap NETIZEN SPEAK UP MENGENAI KESULITAN PAKE BPJS SAAT DI IGD MAUPUN MINTA RUJUKAN KE RS ... 🙏🙏🙏",0,https://www.instagram.com/bpjskesehatan_ri/reel/DOFuU_ngZ13/,https://www.instagram.com/bpjskesehatan_ri/reel/DOFuU_ngZ13/?comment_id=18100073983540078
18025463360715589,2025-09-08T03:04:28+00:00,gasendra3.craft,"Suami saya waktu itu sakit, dibawa ke puskesmas, oleh pihak puskesmas dianjurkan ke RS tanpa diberi surat rujukan, saat sampai dirumah sakit katanya harus bayar, kartu BPJS tidak dapat digunakan jika tidak ada yang Gawat Darurat, sekarang pakai BPJS agak gimana gitu akhirnya kami mikirnya percuma punya BPJS  toh menggunakannya gak bisa kalau gak darurat. Selain itu dari puskesmas sendiri mengarahkan ke rumah sakit tapi tidak memberi rujukan. Hadewhhhhh .... Posisi lagi sakit lho ... Harus lari sana sini",0,https://www.instagram.com/bpjskesehatan_ri/reel/DOFuU_ngZ13/,https://www.instagram.com/bpjskesehatan_ri/reel/DOFuU_ngZ13/?comment_id=18025463360715589
17939923692058897,2025-09-08T01:00:30+00:00,sahnashidayah,🔥🔥🔥🔥,0,https://www.instagram.com/bpjskesehatan_ri/reel/DOFuU_ngZ13/,https://www.instagram.com/bpjskesehatan_ri/reel/DOFuU_ngZ13/?comment_id=17939923692058897
17985261017853393,2025-09-07T17:33:22+00:00,sultan_sudirman17,"pandai ngomong juga ini bapak, kelapangan pak lihat langsung bagaimana implementasinya 😢",1,https://www.instagram.com/bpjskesehatan_ri/reel/DOFuU_ngZ13/,https://www.instagram.com/bpjskesehatan_ri/reel/DOFuU_ngZ13/?comment_id=17985261017853393
18204852442308609,2025-09-07T13:59:35+00:00,pungkas_indratmo,"Anak saya didaftarkan ke dokter gigi secara online  ke rsud hermina cileungsi,setelah mendapat rujukan dr rumah sakit tipe C,, tp yang jadi masalah pendaftarannya tiba2 di cancel oleh bpjs,dan ini terjadi 2 kali cancel.. padahal sebelumnya sudah di jadwalkan.. sampai saat ini sudah hampir 3 bulan blm dapat antrian ke dokter gigi",0,https://www.instagram.com/bpjskesehatan_ri/reel/DOFuU_ngZ13/,https://www.instagram.com/bpjskesehatan_ri/reel/DOFuU_ngZ13/?comment_id=18204852442308609
18056353835575400,2025-09-07T13:31:45+00:00,soeara_priboemi,Saya mau cabut gigi bungsu di RS daerah Sidoarjo katanya nggak bisa itu gimana min.?,0,https://www.instagram.com/bpjskesehatan_ri/reel/DOFuU_ngZ13/,https://www.instagram.com/bpjskesehatan_ri/reel/DOFuU_ngZ13/?comment_id=18056353835575400
18050168504536551,2025-09-07T12:06:04+00:00,abuzarsuherman,"Saya anggota BPJS Mandiri, berobat di RS dan dikatakan oleh dokter kontrol 1x sebulan, tapi obat yg diberikan hanya utk seminggu minum, kondisi seperti itu sudah berlangsung cukup lama",0,https://www.instagram.com/bpjskesehatan_ri/reel/DOFuU_ngZ13/,https://www.instagram.com/bpjskesehatan_ri/reel/DOFuU_ngZ13/?comment_id=18050168504536551
