text,label_pks
halo admin tunggak saudara masuk ketenagakerjaan admin solusi admin bayar tunggak admin,saran
program siksa rakyat,keluhan
lowong,saran
gaji katung katung nasib tepuk tangan apresiasi puji,keluhan
bayar usaha muncul denda masuk akal,keluhan
semangat,pujian
pindah tahan kuat jebol ribet jaring,keluhan
admin,saran
jadi awas lapang sop bu buat tim,saran
ganti nomor akun tangan doa mohon terima kasih syukur,saran
oke,keluhan
mata hati cinta gila gila,pujian
program,keluhan
konten,keluhan
admin umum lomba undur,pujian
menu kayak gue sekolah menang tertawa lucu,pujian
admin,keluhan
rombak ulang sistem kembali sistem,keluhan
pegawai data bocor duh proyek [BADWORD] gue,keluhan
kayak denda telat bayar lapor log in suka susah masuk gilir pas masuk susah dokumen mending,keluhan
maaf izin lancar bayar akibat pending layak hambat masalah dian dana,saran
admin sehat aktif aktif syarat admin,saran
permisi admin status bilang aktif aplikasi aktif admin admin,saran
atur bang abang panitia,saran
urus perintah daerah sulit,keluhan
komen komplain gubris anggap notifikasi,keluhan
bingung linglung mabuk kecubung,keluhan
sedih mending sekolah siswa kasih tanda biar anggar butuh,saran
mantap,pujian
menang sedu sedu sedih ekstrem,keluhan
susah orang indonesia,keluhan
gaji bayar rapel,keluhan
oi akses bayar mahal doang kerja becus habis tepuk tangan apresiasi puji,keluhan
gas aktif,saran
tepuk tangan apresiasi puji tepuk tangan apresiasi puji,pujian
sih muncul menang sedih menang sedih menang sedih,keluhan
kerja tumpuk sabtu menang sedih menang sedih,keluhan
sih baru pas jam sibuk,keluhan
sengaja uji uji,keluhan
tingkat arus kas usaha farmasi sehat indonesia maksimal kumpul piutang atur syarat kredit ketat tingkat jual butuh pasu alas coba tarik langgan jual produk tingkat kuantitas jual langgan cepat tagih piutang kirim tindak lanjut tagih rutin bayar tunda efektif tingkat arus kas usaha catat kirim kendali keluar operasional salah tingkat arus kas usaha kait biaya operasional potong biaya cari alternatif murah sistem buku efisien era modern catat rapi manual identifikasi arus kas cepat sentuh akuntansi teknologi efisiensi manfaat pinjam jangka pendek bijak pinjam jangka pendek solusi tutup kurang arus kas jual aset produktif kumpul aset produktif bisnis laku jual aset aset pantau arus kas kala,saran
dapur contoh,pujian
main adik aplikasi,keluhan
mudah mudah guna,saran
halo admin layan pasien sakit pasien alami komplikasi sakit,keluhan
bayar pajak,keluhan
titip hama,keluhan
allah pimpin hilang muka bumi indonesia,keluhan
moga bayar biaya sehat bulan lindung allah,pujian
mantap disiplin buk pasti hukum lindung anak buk,pujian
lapor bayar eh buku debit kredit deh benar bikin pusing,keluhan
benar faktur keluar gue tumpuk unggah bentar pusing otak menang sedu sedu sedih ekstrem banget,keluhan
klik lapor bayar muncul nih menang sedih staf remah lo atas tau lihat kerja hari menang sedu sedu sedih ekstrem,keluhan
admin rujuk serta sep daftar aplikasi verifikasi registrasi ulang rujuk laku,saran
sebal,keluhan
malam sih,keluhan
keren aplikasi mudah tepuk tangan apresiasi puji,pujian
baca komen,keluhan
atur masyarakat sosialisasi masyarakat bentur langsung turun tugas,saran
lihat daftar sakit,saran
weh mantap,pujian
info,pujian
anak sekolah menu sesuai program sehat gizi sekolah keluh makan an menu an nasi mental enak sa terima kembang jakarta barat,keluhan
admin perkara registrasi beres gagal kali kali daftar pulsa verifikasi nomor menang sedih menang sedih,saran
lapor,keluhan
aplikasi mu benar kerja baru gaji,keluhan
admin telat bayar langsung status non aktif,keluhan
program moga jalan orang tangan angkat raya sukses,pujian
email,keluhan
kerja aktivasi situs akses keluar atur pasti mudah paham laksana kerja akses susah isi salah,keluhan
benar,keluhan
gaji lepas didik gaji butuh hidup kerja ikut atur dasar loyal tugas hidup,keluhan
mohon baik tanggal unggah keluar dampak perhati,keluhan
tidur air liur ingus antuk bosan,keluhan
rekap guna polis sehat biar komprehensif admin,saran
kentut,keluhan
admin lapor anggap lapor hem,keluhan
kakak makan daging sulit cari lapang kerja indonesia ekonomi keluarga sulit mahal butuh pokok rumah tangga makan enak program anak sekolah,pujian
oi,keluhan
oi,keluhan
pimpin sulit banget tepuk tangan apresiasi puji,keluhan
minimal ulang bunyi admin biar,saran
anak gadis nih terima kasih makan gratis tangan doa mohon terima kasih syukur,pujian
anak sedih banget menang sedih menang sedih,keluhan
bikin bijak [BADWORD],keluhan
bu pusing akses menang sedih,keluhan
aktivasi susah,keluhan
mati dagang area sekolah,keluhan
keren,pujian
sistem januari pakai pakai subuh,keluhan
faktur terang salah klip kasihan usaha tagih kendala aplikasi mu matang,keluhan
sistem ribet,keluhan
ganti nominal tera centang kredit bikin bingung nominal nol,keluhan
ri admin daerah kubur nada lembut air bahaya cek kandung air,keluhan
verifikasi no masuk masuk,keluhan
kembali aplikasi pajak susah,keluhan
beda sekolah,keluhan
rasa atur [BADWORD] anak kondisi trombosit ribu tolak alas layan puskesmas kondisi anak lemas daya bayar iur rutin telat sekian opname tolak tiada alih asuransi sehat,keluhan
tindak muncul,keluhan
admin anak lahir pas bayar tagih sekian ribu daftar tagih lahir tagih aneh banget,keluhan
menang sedih,keluhan
aplikasi payah,keluhan
evaluasi dapur intens olah distribusi akuntabilitas uang gaji program manfaat masyarakat anak sekolah irit jajan balita buka lapang kerja dapur produk tani serap intens sinergi,pujian
kejar standar kelola perhati pagu anggar rugi kelola perhati upah rawan rendah orang kerja capai bayar manusiawi alas utama muncul dapur,keluhan
andai jadi beasiswa total biaya capai juta lulus dokter juta lulus teknik alokasi triliun hasil sarjana dokter sekian juta sarjana teknik butuh sekian juta bagi sederhana kapasitas dana capai juta lulus dokter bidang teknik lulus biaya juta dokter aktif indonesia butuh ideal dokter tambah,saran
admin capai realisasi pajak menang tertawa lucu,saran
juara,pujian
baik hambat kerja lelah lelah lelah lelah lelah lelah,saran
yuk,saran
bisnis ada sertifikat nih dapur sertifikasi layak akselerasi kasih harga,keluhan
beda kakak suami istri kes kakak info,keluhan
demo sih,keluhan
utang kali iya lunas berat sih vendor aduh,keluhan
anak sekolah desa anak kader sekolah sekolah adil nih anak indonesia,keluhan
sekolah ponakan seru admin menu kadang spageti ayam,pujian
modal,saran
selamat ulang presiden,pujian
orang,keluhan
sayang balik harap tangis lapar perut anak istri kerja laksana wajib tugas tanggung sukses program upah kerja janji janji kontrak kerja perhati butuh makan butuh gajih bayar langsung hidup keluarga bu,keluhan
istigfar tangan doa mohon terima kasih syukur senyum menang bahagia sedih lega,keluhan
atur oktober surat rujuk pol rumah sakit,saran
program elite gaji sulit,keluhan
ayo aktivasi akun mudah lapor urus pajak tepuk tangan apresiasi puji,saran
tepuk tangan apresiasi puji tepuk tangan apresiasi puji tepuk tangan apresiasi puji tepuk tangan apresiasi puji,pujian
bayar pajak,keluhan
ikan hiu saus sambal,keluhan
sehat rutin bayar iur,pujian
rencana tingkat bayar [BADWORD] faktur bayar pajak admin fasilitas kacau,keluhan
atur menang tertawa lucu log in susah iya lebaran log in layar putih capai,keluhan
bayi usia,saran
lamar ahli gizi,saran
admin kredit pajak ikhlas bayar,keluhan
ganti direktur pusing,keluhan
[BADWORD] email kirim pagi balas subuh asu,keluhan
he suruh sih pusat bayar utang main main,keluhan
admin izin memang rujuk tunggu alas kuota rujuk hari penuh sistem rujuk,keluhan
enak,pujian
dirgahayu republik indonesia,pujian
[BADWORD] kerja malam mati [BADWORD] badan putih abadi [BADWORD],keluhan
mantap butuh,pujian
atur ganti februari banget maaf kemarin kemarin,keluhan
aktif nonaktif desa suruh puskesmas puskesmas suruh camat camat suruh desa sakit sinus pakai biaya mandiri uang kambuh pikir nuh nasib,keluhan
lihat orang [BADWORD] senyum sederhana ramah,keluhan
halo admin lupa no solusi,saran
korupsi,pujian
masakan saung teko,pujian
cek admin,saran
astagfirullah,keluhan
asuransi jiwa,saran
lahir isi sih jir daftar [BADWORD],keluhan
yuk aktivasi,saran
tepuk tangan apresiasi puji tepuk tangan apresiasi puji menang tertawa lucu,pujian
jam gin tanggal gin lapor berani bikin menang sedu sedu sedih ekstrem,keluhan
eror retur puter kerja menang sedih,keluhan
susah lelah tanggal menang tertawa lucu,keluhan
jam malam admin lapor menang sedu sedu sedih ekstrem,keluhan
izin lapor kecewa program sekolah bandung salah terima umum alas camat beda rencana batal umum menang sedih kali izin presiden,keluhan
kacau rajalela baik server benar lapor lelah web putar jam lancar,keluhan
hi admin kali bolak muntah minggu pusing kunjung ganti dokter cek darah konsultasi iya sih cek darah demam langsung rujuk dokter spesialis iya sih parah rujuk dokter spesialis atur sulit ada parah iya langsung cek darah rujuk sih heran banget,keluhan
sop bayar gaji admin,saran
sertifikat halal bulan keren sih,keluhan
anda ribu orang racun isi anak cucu keponakan sepupu kepala,keluhan
tangan angkat raya sukses,saran
admin guna unduh mobil daftar masuk wajib daftar,saran
gaji cair bingung fokus kerja orang ber pasu ri,keluhan
ah,keluhan
tanggal unggah faktur pajak agustus tanggal lapor hadiah,keluhan
kerja,saran
tanggal nih,keluhan
tulis an maaf are is,keluhan
janji demo pajak yuk komen gubris dengar,keluhan
admin data pribadi bocor pinjam,keluhan
ri,saran
presiden pimpin serta jajar,pujian
anak racun,keluhan
nih benar nih iur beres,keluhan
moga sarana mudah penuh hak wajib paja,pujian
masak pagi hangat,saran
admin email reset masuk masuk menang sedih,keluhan
kakak coba cek rumah sakit,keluhan
presiden perhati gizi anak jegal program isu racun dampak rasa anak keluarga dapur nih,pujian
moga lindung allah amin,pujian
ri hormat bilang presiden ri,saran
info tepuk tangan apresiasi puji tepuk tangan apresiasi puji,pujian
mantap tangan angkat raya sukses,pujian
menang tertawa lucu menang tertawa lucu menang tertawa lucu menang tertawa lucu menang tertawa lucu menang tertawa lucu menang tertawa lucu menang tertawa lucu,pujian
sasar utama kayak,pujian
kode email astaga,keluhan
halo admin tes hiv tindak laser operasi tanggung gantung,saran
otak siksa banget,keluhan
selamat ulang presiden sehat senantiasa lindung allah ta ala,pujian
akun seru,pujian
admin daftar,keluhan
admin fasilitas kacamata mohon info,saran
admin cek,saran
tuli banget keluh guna,keluhan
unggah tanggal admin menang tertawa lucu,saran
ah menang tertawa lucu,keluhan
banget ambisi atur,keluhan
isi orang kompeten ahli gizi kerja uang masuk [BADWORD] menang tertawa lucu,keluhan
lalai sop tindak bedah minor pakai,keluhan
admin badan pilih menu lampir menang sedih,keluhan
mending urus serta lolos dadak lolos habis bayar nih masuk anak kenal menang tertawa lucu menang tertawa lucu menang tertawa lucu,keluhan
tepuk tangan apresiasi puji tepuk tangan apresiasi puji mata hati cinta gila gila mata hati cinta gila gila,pujian
mohon atensi keluh menang sedih,keluhan
admin info edar tunggak iur hapus serta,saran
admin gigi pakai,keluhan
masuk kak,keluhan
info tangan angkat raya sukses,pujian
keren nih,pujian
siang admin admin bayar tanggal tanggal uang tarik status terima bank admin,saran
mata hati cinta gila gila mata hati cinta gila gila mata hati cinta gila gila mata hati cinta gila gila,pujian
admin cek tangan angkat raya sukses,saran
ambek kode kirim email wajib pajak musim lapor tahun orang pribadi,keluhan
ayo kirim,saran
selamat bu,pujian
[BADWORD],keluhan
bandung barat racun ratus siswa kasih makan menang tertawa lucu menang tertawa lucu menang tertawa lucu menang tertawa lucu uji coba reaksi masyarakat menang tertawa lucu menang tertawa lucu menang tertawa lucu demo aman lanjut kocak,keluhan
terima kasih ilmu,pujian
ojok [BADWORD] [BADWORD] po menang sedih menang sedih menang sedih,keluhan
info,pujian
berita kak gaji gaji ironi khusus masuk jalur titip partai ikut seleksi ikut daftar didik militer tau aneh gaji dapur heran kalo racun didik,keluhan
malam pas proses gagal,keluhan
garang aduh lihat lapang kemarin racun insiden,keluhan
cuci tangan admin,saran
admin kartu fisik hilang urus kartu fisik,keluhan
makan racun gratis,keluhan
ayo riwayat sehat mata hati cinta gila gila,pujian
info,pujian
hapus tunggak,saran
pajak,keluhan
alhamdulillah manfaat masyarakat indonesia,pujian
[BADWORD],keluhan
apa bikin stres,keluhan
gaji daya gaji,keluhan
kayak,saran
tunggu sih tunggu demo ibu ribu orang,keluhan
sekolah kayak,keluhan
bu cantik,pujian
mantap,pujian
halo admin,keluhan
titip titip serius titip sendal besok pas salat at admin ri kali sendal amanah menang tertawa lucu,keluhan
pasal kait cabut,saran
bayar gaji juli ingkar janji anak istri makan,keluhan
admin serta status nonaktif serta rawat inap aktif,saran
erti sih ultra proses,keluhan
kepala dad setiawan kota semarang hitung didik militer september terima honor bayar badan gizi nasional cair dana magang dapur sebar sabang pikir nasib kerja sulit butuh uang keluarga nafkah hidup cair gaji,keluhan
mohon jelas layan pol onkologi radiasi tipe ada pol rujuk pol onkologi radiasi pol paru kunjung pol paru usaha rujuk pol onkologi radiasi jenjang lanjut tipe rujuk pol onkologi radiasi capai serasa pingpong,keluhan
amanah banget,pujian
makan racun,keluhan
to point komen bahas gaji benar sarjana tembak sesuai bilang latih banget,keluhan
unggah keluar lunas termin hormat menang sedih,keluhan
bicara racun tahap wajar sih [BADWORD] bicara,keluhan
kantin sekolah solo uji tutup uji kocak banget asli menang sedih,keluhan
moga konsisten susah konsisten,pujian
yuk bareng spam komen tau langsung,keluhan
gaji bayar menang sedih ri,keluhan
baik konsisten tangan angkat raya sukses,pujian
coba kali kali verifikasi wajah gagal coba hapus unduh ulang admin bayar darah menang sedu sedu sedih ekstrem menang sedu sedu sedih ekstrem,keluhan
bikin susah menang sedih kembali aplikasi pajak taat bayar sulit allah,keluhan
tepuk tangan apresiasi puji tepuk tangan apresiasi puji,pujian
kakak balik bijak bijak susah rakyat,saran
tangan angkat raya sukses,pujian
gaji,keluhan
[BADWORD],keluhan
anak demam kejang trombosit sakit banget tunggu,keluhan
botak nutrisi,keluhan
ter ekspos porsi bagus,pujian
gaji bayar botak tau malu,keluhan
faktur menang sedih menang sedih,keluhan
tepuk tangan apresiasi puji tepuk tangan apresiasi puji menang tertawa lucu,pujian
moga baik depan,pujian
tepuk tangan apresiasi puji,pujian
pakai lahir bidan dokter lahir bidan bawa pakai ribet pakai rujuk,saran
jumat tambah susu protes dapur akun coba protes dapur buah jeruk pisang biji,keluhan
iya iya etik sabar eh pas,keluhan
iur bayar,saran
alaikum,saran
bikin faktur pajak minggu kemarin faktur tumpuk,keluhan
admin cek lab hamil rujuk,saran
aplikasi mu mending benar deh,saran
kentang tempat gue hitung jari,keluhan
jempol tuju bagus jempol tuju bagus jempol tuju bagus,pujian
aduh lapor lapor telat denda kayak kemarin januari telat lapor kena denda surat cinta intip malu malas,keluhan
admin pergi gigi anak,saran
admin,saran
tepuk tangan apresiasi puji tepuk tangan apresiasi puji,pujian
menu waras,keluhan
assalamualaikum,pujian
pas daftar email masuk ih banget bikin emosi,keluhan
etik pajak keluar jalan etik hitam nama barang sih,keluhan
parah sakit jamur kasih obat rumah sakit minggu obat obat minggu obat,keluhan
berani taruh bera evaluasi tambal sulam anggar triliun kelola kelas usaha makam minum standar internasional,saran
moga kaum fitnah usak binasa,keluhan
admin status aktif usia anak admin,saran
stabil sih sistem pakai sebentar langsung sistem bikin orang muntah darah doang hari buka jam pagi jam malam,keluhan
admin serta idap diabetes hipertensi riwayat sehat laku oktober puskesmas mohon jelas,saran
ikan lele masuk bikin le menang tertawa lucu menang tertawa lucu,keluhan
mundur blok [BADWORD] orang [BADWORD] kayak menteri,keluhan
halo ecek perintah gratis rt perintah ecek,keluhan
trombosit minimal rawat pakai bayar rumah sakit rawat,saran
kelas badan milik negara layan negara bodoh rakyat tutup fakta data penting kantor,keluhan
apes,keluhan
bagus referensi kak,pujian
harga obat klaim rumah sakit naik,keluhan
[BADWORD] [BADWORD],keluhan
menang tertawa lucu menang tertawa lucu,keluhan
tunggu menu,pujian
informasi tanggung hukum buka milik partai dewan orang buka tutup,keluhan
kembali malu mending aku,keluhan
baik,saran
[BADWORD],keluhan
dirgahayu,pujian
pantau sistem luncur menang tertawa lucu menang tertawa lucu menang tertawa lucu menang tertawa lucu menang tertawa lucu menang tertawa lucu menang tertawa lucu menang tertawa lucu menang tertawa lucu menang tertawa lucu menang tertawa lucu,keluhan
kerja tumpuk gara ganggu minggu tim developer,keluhan
yuk yuk yuk,saran
tulung teman ku amuk cerita senyum sederhana ramah senyum sederhana ramah senyum sederhana ramah,saran
keren nih buah pakai premium,pujian
negara program gatot,keluhan
bayar hak,keluhan
admin saran nih iya masuk ahli gizi bu ahli gizi dosen ahli ahli masuk sesuai bidang,saran
anak orang racun,keluhan
admin sih iur kelas turun kayak admin kayak berat banget keluarga,keluhan
jempol tuju bagus,pujian
tebal muka tepuk tangan apresiasi puji tepuk tangan apresiasi puji,keluhan
admin sistem bagus harap pakai tanggal kasih relaksasi sistem bagus,saran
daftar sulit banget kemarin email masuk no ribet banget,keluhan
kerja agustus gaji kerja makan susah cari makan lucu tangan angkat raya sukses,keluhan
cek daftar,keluhan
makan racun gratis menang tertawa lucu menang tertawa lucu tunggu korban jiwa mundur,keluhan
kemarin bikin jam malam,keluhan
tepuk tangan apresiasi puji,pujian
program gagal,keluhan
tepuk tangan apresiasi puji,pujian
info,saran
benar kamar melulu oi sanksi benar baru biar kerja,saran
pantas,keluhan
halo pas kontrol klik in daftar kontrol,saran
kena,keluhan
minimal info bu tangan doa mohon terima kasih syukur baru menang sedih gebrak uring tanggal baru jam menang tertawa lucu,keluhan
raja,keluhan
keren,pujian
kamis lo verifikasi tunggu menit habis kode masuk email,keluhan
lembur tunggu akses jam malam capai banget,keluhan
minggu nih eror,keluhan
kabar korban jatuh gara gara bisa bilang kabar menang sedih,keluhan
kakak pakai tambah serta biar,keluhan
admin,saran
suntik bayar kacau nih bayar bulan suntik harga juta bayar,keluhan
dinas pajak pasar rebo pakai pakai payah,keluhan
halo buka log tanggal menang sedu sedu sedih ekstrem,keluhan
balas admin,saran
mata hati cinta gila gila mata hati cinta gila gila tepuk tangan apresiasi puji,pujian
kode banget pas masuk jam jam bikin benar,keluhan
admin masuk akun tulis perangkat nomor induk duduk beda info hubung kayak deh ambil antre bantu tangan doa mohon terima kasih syukur tangan doa mohon terima kasih syukur,keluhan
ayo benar lembar desember kurang pajak masuk salah,keluhan
nih,keluhan
selamat malam admin sehat suami kerja pt cerai suami suami aktif kartu denda urus,saran
pesta raya selamat,pujian
sukses bagus and semangat,pujian
moga lancar wajib pajak bahagia jaya indonesia juara,pujian
gaji tolong bayar masuk bayar kerja maksimal gaji bayar beranta keluarga mohon proses cepat gaji tangan angkat raya sukses ri,keluhan
semangat rekan rekan balik insiden awas ketat tangan doa mohon terima kasih syukur plus masyarakat kerja moga evaluasi program jalan,pujian
info,pujian
program program [BADWORD] kasih racun makan,keluhan
fungsi sesuai,keluhan
gaji ri ri,keluhan
cek lab tiroid pasien rujuk kelas bayar suruh bayar juta cek lab pasien rujuk diagnosa,keluhan
eh kayak,keluhan
admin cek tangan doa mohon terima kasih syukur,saran
menang tertawa lucu menang tertawa lucu menang tertawa lucu tinggal orang beres kualitas sistem kayak orang borong,saran
atur bang abang panitia,saran
admin baca komen teman paja sistem pakai anggar lumayan sistem sih sistem bagus anggar kembang modifikasi sistem tutup sistem oke anggar sistem salah lalai sistem luncur uni coba resmi alhasil usaha sulit rugi sistem terap kerja akuntan konsultan pajak ancam pecat tanggung kantor pajak solusi kes lucu sistem kerja adaptasi pusat sosialisasi kerja bingung tangan sekian,keluhan
main kepala dad jadi hebat ari,keluhan
baru sistem bikin umum biar tau panik gara bikin faktur keluar kerja pajak pintar,keluhan
kerja sih muntah jijik,keluhan
dasar atur,saran
hormat baik sistem minggu eror pakai ruwet uap hidung marah kesal,saran
oi gaji,keluhan
lulus admin susah banget lulus nyeri kerja menang sedu sedu sedih ekstrem,keluhan
balita deh,keluhan
menu enak,keluhan
admin coba deh surat rujuk lihat pasien derita demensia ajak puter surat rujuk keluarga sih pasien,saran
tarif pajak muncul,keluhan
laku sertifikasi layak buka,saran
si na dada,keluhan
info sedia kamar kosong pas turun tingkat,keluhan
ironis kepala asal tuntun jam awas operasional dapur gaji beri sejahtera rata terima sistem uang lucu kakak milik risiko pidana,keluhan
admin bikin kartu sehat anak umur syarat,keluhan
selamat milad bicara sekolah anak ku nama harap jaya bekas utara,keluhan
admin daerah gue menang tertawa lucu,keluhan
bikin email atur baru kait ah malu malu,keluhan
program orang,keluhan
hari unggah susah kali oi,keluhan
unggah keluar hasil status ikon muncul pas unduh terang salah internal server eror tau solusi,keluhan
oi,keluhan
negeri masuk swasta notabene,keluhan
mata hati cinta gila gila mata hati cinta gila gila mata hati cinta gila gila,pujian
admin berita tunggak,saran
puter bikin kerja tumpuk gilir telat tau bikin emosi jiwa,keluhan
coba anak kena tenang,keluhan
admin akun ri telegram aktif kemarin coba cek status serta telegram suruh kirim no no rekening suruh kirim foto kode kirim wa,saran
mundur,keluhan
kak sih umum lomba benar umum batal kak,keluhan
tepuk tangan apresiasi puji tepuk tangan apresiasi puji tepuk tangan apresiasi puji tangan bentuk hati cinta dukung tangan bentuk hati cinta dukung,pujian
bijak tambah batas unggah faktur agustus libur sabtu timbang,keluhan
bodoh,keluhan
wawancara terima gaji wawancara terima gaji biaya hidup hari gaji keluar janji september keluar gaji nyata pulau jawa gaji pulau jawa keluar gaji terima gaji perhati prioritas ri kabinet ri presiden ri,keluhan
negara atur ubah sepuh konsultan pribadi weh kena serang jantung pikir pajak,keluhan
admin target november tunggak hapus perintah,saran
program [BADWORD] program,keluhan
gue baik web blok sih,keluhan
kepala mundur sih botak mundur bagus beliau informasi habis presiden,keluhan
lambat oke juga upaya investigasi kait marak racun,pujian
teman,saran
parah admin pulsa makan situs eror ah,keluhan
permisi kak butuh tutup pasang harga tutup pasang,saran
kemarin benar data ganti email nama wajah balik canda sarkasme ringan bodoh,keluhan
pakai rujuk,keluhan
bisa rilis berita ribu anak racun manusia angka,keluhan
tepuk tangan apresiasi puji tangan angkat raya sukses,pujian
gizi,keluhan
bau bau periksa jaksa agung nih lapor pajak suruh nih bilang lo,keluhan
halo kait timbang tagih tagih masuk kena dampak atur laku surut revisi faktur revisi ubah usaha pakai sistem tulis pakai tangan sistem set tarif butuh bayar bayar masuk suruh revisi sehat,keluhan
admin anak bikin fisik masuk admin,saran
oi,keluhan
isi masuk rusak kerja [BADWORD] tes,keluhan
dirgahayu badan gizi nasional,pujian
program kelola pegawai negara keruk [BADWORD] jabat [BADWORD],keluhan
no blokir pandawa admin,saran
admin sehat kartu kena blokir admin,saran
racun ribu anak admin bagus,keluhan
barusan,saran
admin surat rujuk kabupaten surat kontrol sistem kontrol jalan atur bilang kabupaten pindah kers jadwal kontrol dokter,keluhan
kode email masuk,keluhan
selamat ulang moga umur sehat amin,pujian
ayo cair gaji kami butuh hormat kurang hormat kami wakil rekam cair gaji kami,keluhan
info,saran
stop makan anak stop makan layak anak coba evaluasi coba konsultasi ahli gizi korban anak layak,keluhan
pasien pakai selang infus pakai pakai pulang keren dokter,keluhan
biaya salin normal tanggung riwayat periksa,saran
suruh isi data beli materai cair gaji,keluhan
rujuk daerah senang kontrol rumah asa banget diskriminasi menang sedih,keluhan
ketua ahli bidang serangga wakil wartawan nama badan gizi tuai ahli gizi ahli gizi kelas doktor spesialis,keluhan
keren,pujian
masuk suruh verifikasi no sms masuk satu kerja kerja,keluhan
lucu suami pajak data persis tunjuk bikin gara valid,keluhan
serius,keluhan
ah alah dasar panci gosong,keluhan
plan,keluhan
kolom konfirmasi tanda tangan pencet jam jam kali,keluhan
selamat siang,pujian
lanjut,pujian
mudah,pujian
[BADWORD] mudah hongkong,keluhan
makan racun gratis,keluhan
kak tinggal auto debet susah kode verifikasi sms masuk nomer,keluhan
admin sistem minimal kayak biar tunggu menang sedu sedu sedih ekstrem,saran
salam sehat,pujian
minggu bikin pt,keluhan
dapur bu evaluasi total bu dapur anak jalan sop nih menu kering kasih kacang roti serba pakai awet menang sedih,keluhan
lapor realisasi investasi menu muncul,saran
mudah via mudah ketimbang emosi buat,keluhan
lowong,saran
astagfirullah kendala admin jam gin kerja kendala sistem hambat kerja tangan doa mohon terima kasih syukur allah faktur pajak keluar susah tangan doa mohon terima kasih syukur,keluhan
oi benar program [BADWORD] gue unggah faktur pajak keluar menang sedu sedu sedih ekstrem menang sedu sedu sedih ekstrem menang sedu sedu sedih ekstrem menang sedu sedu sedih ekstrem menang sedu sedu sedih ekstrem menang sedu sedu sedih ekstrem menang sedu sedu sedih ekstrem menang sedu sedu sedih ekstrem menang sedu sedu sedih ekstrem menang sedu sedu sedih ekstrem aneh menang sedu sedu sedih ekstrem,keluhan
banget,pujian
