text,label_pks
moga aplikasi bawa baik ubah,pujian
hadir negeri,pujian
faktur menang sedih menang sedih menang sedih menang sedih menang sedih kayak cape tau,keluhan
gue benar kemarin lo menang sedih,keluhan
canggih,saran
maret abad gereget parah parah,keluhan
umum gantung habis duit,saran
halo admin kondisi teman lemas pusing bawa dokter demam turun urus admin daftar data pakai gantung dokter teman tangan tes darah jam hasil lab cek darah lengkap kadar gula normal salah satu trombosit dokter bilang pakai data hasil trombosit jalur aneh paham cek indikasi gejala tipes dokter demam cek gejala tipes paham cek imunologi demam turun alas dokter ecek mayoritas duduk indonesia kebal tubuh tipes mayoritas jaman suntik vaksin tipes teman suntik vaksin tipes capai debat urus suruh tanda kali pakai tanda sekian,keluhan
gagal,pujian
petinggi ahli gizi,keluhan
erti sosialisasi,keluhan
jaga pola makan menang sedih,pujian
admin akuntan ahli gizi gaji wilayah aceh kerja gaji,keluhan
faktur unggah bikin pajak keluar menang sedih,keluhan
susah,keluhan
anak coba,keluhan
ih,keluhan
gaji gaji,keluhan
jaya,pujian
pakai desktop kredit pakai,keluhan
kendala akun verifikasi solusi,saran
solo dapur sehat bangun mandiri paksa tutup ajar sukses tutup kacau fokus sekolah dapur kantin sehat paksa kocak sesuai tuju program,keluhan
lusa kemarin lancar,keluhan
adab menang sedih,keluhan
admin kode transaksi minggu unggah sih baca lawan transaksi info baca invalid capai minggu transaksi susah,keluhan
unggah faktur pajak,keluhan
keren,pujian
aplikasi benar akun,saran
admin keluarga inti,saran
[BADWORD] gue pikir,keluhan
[BADWORD],keluhan
aktivasi mata senyum pipi rona senang puas,saran
kerja otomatis bayar iur pakai sakit sakit kerja stop bayar iur aktif bayar tunggak bantu admin bayar aktif hitung rugi sakit iur ribu,keluhan
halo admin sehat ibu aktif kakak aktif bapak mbak ibu aktif admin mohon cerah,keluhan
info,pujian
keren bantu sehat,pujian
lapor yuk biar main,keluhan
ahli serangga menang tertawa lucu menang tertawa lucu menang tertawa lucu menang tertawa lucu,keluhan
mu,keluhan
coba pakai,saran
admin maksud non aktif suruh pindah mandiri bayar,saran
coba obrol baca biar aplikasi sistem bagus telat bayar salah eh pas obat sulit,keluhan
bilang kasar bayar lo astagfirullah,keluhan
petinggi latar belakang ahli gizi bawah ahli gizi peran utama jalan orang awur an gizi susah banyak situasi semrawut,keluhan
halo admin umum lomba jurnalistik,saran
baca komen susah akses temu unggul bulan ubah masalah cerita admin,keluhan
sekolah anak basi siswa makan bakar uang rakyat,keluhan
sistem gagal menang tertawa lucu menang tertawa lucu menang tertawa lucu sistem susah indonesia raya,keluhan
info menang sedu sedu sedih ekstrem,keluhan
gas,pujian
gaji,keluhan
web jelek,keluhan
minimal gaji menang sedih,keluhan
informasi manfaat tangan doa mohon terima kasih syukur,pujian
admin nik lancar bayar tunggak bikin bingung wa pandawa balas bot,keluhan
duh batas tanggal puter doang kayak admin,keluhan
alhamdulillah cair,pujian
program pelihara bodoh generasi racun,keluhan
permisi lembaga lembaga kait program berangkat latih hasil ubah sistem nilai transparan abang tanggal pagi lulus cetak ubah lulus sistem rekrut kasihan siap tes biaya peluk syarat hasil tes ubah main rakyat orang pilih kerja ikut program dukung program presiden mohon solusi baik tangan doa mohon terima kasih syukur tangan doa mohon terima kasih syukur kasihan orang tua keluar uang ikut program,keluhan
muka kayak,keluhan
tipu rakyat indonesia pajak ada,keluhan
mustika jaya bagi nih rata sih,keluhan
allahu akbar lapor nih,keluhan
gaji oi pikun,keluhan
kak kurang anggota keluarga baharu kakak pisah kakak unggah foto kakak kakak kakak orang tua kakak kakak pisah orang tua,saran
malu menang sedih,keluhan
doang kerja,keluhan
unggah faktur pajak harga masuk kalkulator eror kali kirim tagih bayar pakai,keluhan
sulit juang negeri ampun kita perintah kemarin tolong dana [BADWORD],keluhan
aplikasi [BADWORD] mending pakai daftar susah mending lapor pajak,keluhan
cape kali tolong kerja malam gadang ujung menang sedih,keluhan
korban,keluhan
menang sedih tepuk tangan apresiasi puji tepuk tangan apresiasi puji,keluhan
coba sekian kali batas tulis mas proses bukti terima surat menang sedih menang sedih menang sedih,keluhan
admin ganggu,keluhan
obat pakai obat pakai obat fungsi bayar,keluhan
banget kerja penuh butuh banget kerja,keluhan
admin,keluhan
yuk akun,saran
akun baru,saran
coba lembar desember ret muncul admin,keluhan
pakai mandiri bayar layan batas bangkrut obat pakai kualitas obat bagus kadang obat mending beli resep dokter,keluhan
bohong nih plafon aju klaim revisi standar klaim standar orang kritis sekarat,keluhan
[BADWORD] banget lihat negara afrika miskin main,keluhan
kak pasien rawat inap mandiri kak jam malam oper bolak,keluhan
gaji gaji sengsara ri,keluhan
gas,pujian
buka pagi log in,keluhan
ganti coba rasa susah mudah [BADWORD],saran
ahli serangga ahli gizi nyentrik menang tertawa lucu,keluhan
pakai bayar iur guna efektif ambil puskesmas rujuk tunggu parah indikasi laku sesuai prosedur pas gejala baik kasih anti nyeri sembuh ringan gejala sakit,keluhan
keren [BADWORD] anak indonesia sehat,pujian
aneh potong gaji eh sertifikasi potong tau potong kocak,keluhan
gaji cair,keluhan
abu abu tombol tahun juli,keluhan
benar status in sekali no hilang,keluhan
bikin orang lembur,keluhan
operasi antre dokter siap butuh operasi tanya butuh alat obat tindak operasi sesuai butuh kurang akibat tindak operasi sesuai standar,saran
keren,pujian
halo admin cek,saran
admin mandiri alih perintah nonaktif,keluhan
pagi admin tambah anggota mohon bantu,saran
assalamualaikum izin wilayah depok,saran
gebrak menang tertawa lucu,keluhan
admin,saran
dunia mati pajak,keluhan
sih nih menang sedih,keluhan
kendala server and menang tertawa lucu,keluhan
kirim minta kode otorisasi sertifikat elektronik bagi admin,saran
racun,keluhan
eh [BADWORD] anak [BADWORD] ribu anak racun bilang wajar otak [BADWORD] anak [BADWORD] [BADWORD],keluhan
mudah administrasi paja,pujian
sumbar,keluhan
maaf pakai saudara bayar bayar ribu periksa sakit bayar gaji potong kelas,keluhan
tepuk tangan apresiasi puji tepuk tangan apresiasi puji tepuk tangan apresiasi puji,pujian
web puter faktur butuh jam wajah balik canda sarkasme ringan bodoh,keluhan
kerja apresiasi menang tertawa lucu,pujian
lucu suruh lapor masuk gagal nomor valid kirim pas pakai badan pilih periode lapor admin balas via wa,keluhan
admin orang sakit rumah sakit pakai asuransi,saran
dapur penuh,keluhan
menu eror halaman menang sedih,keluhan
tim rekan santai,keluhan
layan,saran
teman tau pt orang mentok step konfirmasi,keluhan
tau hasil unggah faktur keluar pas unduh kosong menang sedu sedu sedih ekstrem,keluhan
suruh bayar september oktober kantor cabang palembang suruh tunggu tangguh solusi tanggal september september,keluhan
sehat tuhan berkat,pujian
sabtu minggu embel,keluhan
ayo aktif akun,saran
allah maha tau adil moga baik program rida amin,pujian
bikin coba ajar negara sedia makan ajar,saran
eror,keluhan
minggu kemarin kerja puter kerja tumpuk nih duh emosi jiwa,keluhan
lapor nyaman jempol tuju bagus,saran
[BADWORD],keluhan
enak sekolah,keluhan
admin prosedur cek hamil terima kasih,saran
miris,keluhan
hati hati jalan pintas formalin boraks,keluhan
admin puskesmas rujuk pasien puskesmas,saran
habis raih harga tangan angkat raya sukses,keluhan
gagal registrasi badan tanggal kesah sesuai heran indonesia,keluhan
eror halaman temu,keluhan
ampun kerja unggah terang menang sedih gagal kunci akun sering tunggu menit,keluhan
informasi tangan angkat raya sukses,pujian
tara pasang jenis kelas kelas lengkap detail,keluhan
mata hati cinta gila gila,pujian
makan racun gratis,keluhan
[BADWORD] anggap anggap wajar kunyuk,keluhan
mundur malu malu bikin orang derita,keluhan
masuk pakai muncul muncul baik,keluhan
admin tombol simpan minta akses digital klik admin duh,keluhan
admin referensi menu,saran
aplikasi panjang surat program klinik pergi gigi proses tunggu evaluasi,keluhan
admin,saran
dad binatang,keluhan
botak,keluhan
hormat februari susah akses menu manual tunggu menu muncul,keluhan
benar senyum sederhana ramah,saran
alam ku sih cuci beras air air putih biar hilang cepat basi bersih air bening malam nasi enak hangat tanya cuci beras bersih iya takut bersih sebab nasi cepat basi tangan doa mohon terima kasih syukur,saran
cocok badut,keluhan
lapor mas pajak suruh pakai repot bikin telat solusi sih [BADWORD] pakai sok sok an luncur repot,keluhan
berisik web nih bikin kerja orang tumpuk,keluhan
goreng ku bakso,keluhan
makan,keluhan
selamat pagi mohon izin informasi salah produksi makan gizi wilayah tepat lapang pakai latih sepeda motor cross debu khawatir bahan makan alat masak cemar debu hasil latih cross,keluhan
pagi kakak daftar no hilang lupa ganti no isi buka,keluhan
gaji realisasi kerja sepenuh hati butuh gaji,keluhan
man,keluhan
utama korupsi,saran
tombol bayar lapor sembunyi admin,keluhan
tepuk tangan apresiasi puji,pujian
bapa bikin butuh obat hernia bap,keluhan
bikin kerja mandek tumpuk,keluhan
telat lapor deh gara sistem denda,keluhan
tepuk tangan apresiasi puji,pujian
halo anja september obat rumah sakit jantung buat darah harap nasional obat kelas ih malu masak koroner tugas radiologi rusak selesai baik kelas nasional akreditasi internasional masak rusak baik negara perintah sanggup rumah sakit nasional pasien tunggu layan mohon solusi,keluhan
biar ikut lapar mata senyum gembira tawa,pujian
umum lomba nih ri,saran
gaji gaji didik,keluhan
gue daftar gagal coba eh kode email masuk masuk malam habis pulsa,keluhan
impor bukti potong benar,saran
makan gajih [BADWORD] layan suka suka [BADWORD],keluhan
gaji daerah cair,keluhan
semangat rawan dapur mata hati cinta gila gila,pujian
pimpin program hancur menang tertawa lucu tepuk tangan apresiasi puji korupsi otak,keluhan
lulus arsitek admin,saran
tangan angkat raya sukses tepuk tangan apresiasi puji mata hati cinta gila gila,pujian
real orang wajah merah marah marah hebat wajah merah marah marah hebat wajah merah marah marah hebat wajah merah marah marah hebat wajah merah marah marah hebat wajah merah marah marah hebat wajah merah marah marah hebat,keluhan
kerja sih bikin yayasan mending ketua rt,keluhan
admin daftar masuk nik nama tanggal lahir wajah wajah arah kotak arah,keluhan
email banget admin kode masuk,keluhan
uap hidung marah kesal,keluhan
non aktif admin sedih banget sih aktif bantu banget,keluhan
maret operasi kaki april operasi kaki pakai,pujian
praktis sehat peran keluarga admin tangan doa mohon terima kasih syukur,pujian
info atas racun tunda gaji sahabat sahabat,keluhan
info banget,pujian
pimpin banget transparansi kait gaji lapang susah in gaji tanda tera termin tanggal bayar gaji gaji turun pikir nasib bilang rela,keluhan
perintah bayar pajak warga negara bikin aplikasi sempurna luncur,keluhan
halo admin daftar klik tombol lengkap isi data status alamat usaha isi hasil mohon baik kait kendala,keluhan
faktur pajak muncul,keluhan
eh botak [BADWORD] anak cucu racun bilang wajar,keluhan
masyarakat pasien kelas pindah tipe irit biaya dokter tipe murah obat beda tangan doa mohon terima kasih syukur tangan doa mohon terima kasih syukur,saran
puter bantu,keluhan
sayang sayang niat raja anggap sepele,keluhan
marah,keluhan
admin kawan baharu digit via,saran
admin uang titip pikir keras ragu ragu,keluhan
obat persis tahu beda obat tipe beda obat tipe jenis obat program rujuk tipe,saran
cuti senyum keringat dingin bahagia lega tawa canggung,keluhan
jempol tuju bagus jempol tuju bagus,pujian
butuh banding anak kota,saran
maksud pakai tau makan gizi,keluhan
mata bintang kagum kes tangan angkat raya sukses,pujian
sih takut racun ganti roti susu buah keju kasih minggu rapel,saran
botak [BADWORD] botak botak anak,keluhan
mudah depan lancar,pujian
lapor admin,keluhan
informasi tepuk tangan apresiasi puji,pujian
pantau sepi patung moa objek lulus lulus lulus tanggal patung moa objek patung moa objek patung moa objek,keluhan
komentar serang menang tertawa lucu,keluhan
bayar,keluhan
jebak nih trauma bentul tarif unjung ujung info bikin sesat,keluhan
dengar aspirasi gaji juli oktober bayar menang sedih,keluhan
halo pindah via,saran
terap kabar janji janji benah cepat lancar bebas salah tinggal janji serius baik digitalisasi lemah,keluhan
demo bayar ri,keluhan
makan lantai tanak kotor,keluhan
kepala sembunyi wakil kecut menang tertawa lucu,keluhan
gaji,keluhan
mantap rekrutmen non doktor admin mata hati cinta gila gila,pujian
adu,saran
cerita rakyat doang sih sekolah gue,keluhan
pegawai asuransi,keluhan
hidup liku menang tertawa lucu,keluhan
sabar ubah,pujian
badan,saran
kabar kaya pajak admin heran sih kembali faktur tagih gue kirim gara asi asa,keluhan
hai hai payah,keluhan
mudah mudah tutup jelas gaji,keluhan
migren sistem wajah leleh panas canggung,keluhan
halo admin atur kontrol,keluhan
bu hati seret akhirat salah tim buat lapang,keluhan
anak coba lambat sali,saran
imbang kentut,keluhan
gayung lihat kasih hambar bau uap hidung marah kesal,keluhan
riset daerah tahap tuju langsung biar gizi cukup and tahap tahap anak anak cerna kuat orang dewasa paham isi orang kompeten program senyum menang bahagia sedih lega senyum menang bahagia sedih lega senyum menang bahagia sedih lega,keluhan
gajih tangan doa mohon terima kasih syukur,keluhan
alhamdulillah lapang kerja gizi penuh anak indonesia peluk kasih sayang nyaman,pujian
malas gaji,keluhan
suruh revisi,keluhan
sih makan dana korupsi,keluhan
sulit warga negara taat atur menang sedih,keluhan
halo sistem gaji staf hitung gaji lambat terima gaji,keluhan
menu bayar lapor hilang mumet,keluhan
mulia mati kode verifikasi lapor susah ampun susah banget kode verifikasi masuk email no telepon suka susah inovatif susah masyarakat taat lapor bayar pajak sumber besar asal pajak bayar masyarakat mati hapus sistem kode verifikasi akun,keluhan
ganggu ambil antre kontrol malam,keluhan
baik atur tentu masak kelas lengkap tes gula darah kolesterol asam urat praktik dokter rangkai mentok biaya ribu pakai kelas telat bayar layan tes tes sulit tau pakai duit setor pakai butuh periksa,keluhan
balas,keluhan
benar oi lot banget,keluhan
tepuk tangan apresiasi puji tepuk tangan apresiasi puji,pujian
terima kasih info tangan angkat raya sukses,pujian
tolong sistem rusak bantu cari alternatif buka kayak guna selesai kerja hindar denda paksa sengaja kena denda paksa fasilitas guna badan,keluhan
racun ikan hiu gratis ikan hiu,keluhan
pantau lapor,keluhan
aduh melulu benar kemarin lusa faktur pajak kerja tumpuk,saran
laut weh menang tertawa lucu,keluhan
stabil korupsi sih korupsi siksa,keluhan
tepuk tangan apresiasi puji,pujian
kode verifikasi masuk menang sedih,keluhan
coba unggah unggah simpan baca salah,keluhan
impor keluar kerja menang sedih,keluhan
usaha pakai alhamdulillah tunggu wajah leleh panas canggung,keluhan
aduh kali lanjur betul desember wajah kes ganggu,keluhan
asalamualaikum alaikum jalan pasar induk tipe tipe tipe area pasar induk terminal real grand alamanda aurora puri royal terima jasa interior rumah rumah bobrok miskin hancur info lengkap profil,saran
admin mutih iur,saran
lapor,keluhan
senang bahagia nyaman orang tua siswa cemas takut ragu beda menang sedih,keluhan
ambil untung menang tertawa lucu,keluhan
allah darurat kasihan orang tua bulak rumah rumah sakit rumah rumah sakit kena omel daftar rumah sakit tingkat layan mutu,keluhan
admin log in daftar pakai no lupa,saran
keren mata hati cinta gila gila mata hati cinta gila gila,pujian
telat banget lapor fitur lelah lelah,keluhan
lihat anak didik mu hina,keluhan
eror,keluhan
ha bantu klik masuk hilang juta impor nongol menang sedu sedu sedih ekstrem,keluhan
januari tanggung,keluhan
pagi admin kait tunggak putih november,saran
baru telepon pagi benah ganggu sederhana kode masuk email,keluhan
susah bayar pajak,keluhan
kerja malam,keluhan
modernisasi sistem pajak indonesia tingkat terima pajak indonesia,saran
admin sistem rekam,saran
makan racun gratis menang tertawa lucu menang tertawa lucu menang tertawa lucu iya,keluhan
karyawannya titip,keluhan
pakai tes nasional program anak modul tingkat pakai kali lot stabil daerah stabil manual,keluhan
enak damping bantu mitra tempat benar kerja bantu mitra buang,keluhan
menang sedu sedu sedih ekstrem menang sedu sedu sedih ekstrem menang sedu sedu sedih ekstrem menang sedu sedu sedih ekstrem ajar februari bicara ubah atur mata kaca kaca penuh sentuh mata kaca kaca penuh sentuh senyum menang bahagia sedih lega paham baru atur gebrak menang sedih menang sedih menang sedih cape tau ribut cape tau atur ubah cape urus menang sedu sedu sedih ekstrem menang sedu sedu sedih ekstrem gue asa tua admin sistem atur gembor desember kemarin menang sedu sedu sedih ekstrem menang sedu sedu sedih ekstrem menang sedu sedu sedih ekstrem menang sedu sedu sedih ekstrem menang sedu sedu sedih ekstrem,keluhan
jam,keluhan
program jalan asli,keluhan
sore,saran
dapur lalai tindak bu denda program jalan aceh rasa manfaat orang tua bantu siap jajan bekal makan rumah maju,saran
kak,keluhan
kena kontaminasi,keluhan
aplikasi eror,keluhan
mending mundur [BADWORD] orang kayak undur nama coba bunuh massal,keluhan
rekrutmen korban harap palsu ket lulus tau tau lulus pas berangkat didik pas panitia lepas tangan tanggung diskriminasi bohong bagaiman laksana program politisasi,keluhan
racun post,keluhan
serius sabtu minggu kemarin menang tertawa lucu,keluhan
pakai rawat inap kali bulan diagnosa,saran
kemarin sakit perut diare habis makan sekolah gizi bolak dokter,keluhan
suruh pilih pajak bulan kerja mundur zaman,keluhan
admin hapus data anggota keluarga tinggal wa pandawa,saran
jempol tuju bagus,pujian
[BADWORD] [BADWORD] bicara indonesia negara sejahtera,keluhan
baik administrasi paja,saran
maaf admin hormat undang usaha wajib daftar karyawan serta keluarga program sehat fakta kerja detik ikut tindak kait teori bukti undang fakta maaf kasih mohon perhati,keluhan
seko anak menu banyak makan menang sedih,keluhan
tangan angkat raya sukses tepuk tangan apresiasi puji,pujian
pusing admin kerja beres moga lekas sembuh bikin susah kerja,keluhan
kode menang sedih menang sedih tanggal unggah,keluhan
ayo kena lelet banget kerja sayang,keluhan
sehat umur presiden ku tangan angkat raya sukses,pujian
cape banget admin unggah pajak iya unggah barang gagak tolong menang sedih menang sedih,keluhan
kemarin badan,keluhan
dirgahayu doa doa upaya upaya iring tangan doa mohon terima kasih syukur tangan doa mohon terima kasih syukur tangan doa mohon terima kasih syukur,pujian
susu kemas kadar susu segar intoleran air putih,saran
otomatis terima hasil,saran
tolak nyata kepala wakil pimpin aku salah kepalang keluar nyata rakyat suara wakil suruh maaf skenario andal mang bijak,keluhan
propaganda kuno,keluhan
sih uji hari menang sedih menang sedih,keluhan
info admin,pujian
ahli serangga,keluhan
halo admin aplikasi perlu klinik hasil hitam,keluhan
keren mata hati cinta gila gila mata hati cinta gila gila,pujian
mohon sulit kakak verifikasi wajah kasihan sakit banget anak banget bayi verifikasi muka moga verifikasi gagal klik lewat langsung verifikasi no email tangan doa mohon terima kasih syukur,keluhan
tepuk tangan apresiasi puji tepuk tangan apresiasi puji tepuk tangan apresiasi puji,pujian
kerja mudah proses,saran
lulus kalah fulus menang tertawa lucu menang tertawa lucu menang tertawa lucu menang tertawa lucu menang tertawa lucu,keluhan
bu sistem baik menang sedih,saran
kemari parah bikin kosong isi,keluhan
balas admin,saran
jalan gaji pas bayar bulan senyum menang bahagia sedih lega menang sedu sedu sedih ekstrem,keluhan
eror,keluhan
ubah suka,keluhan
copot kepala,keluhan
benar nih banget,keluhan
negeri bagus enak sekolah,pujian
tanggung perihal ambil peran ampun,keluhan
butuh gizi memang orang sakit menu hambar,keluhan
pajak rakyat suka salah oknum mayoritas,keluhan
baru sistem via telepon wa,saran
botak menang tertawa lucu,keluhan
admin daging tumbuh kuping jenis kelenjar dagu operasi mohon admin terima kasih,saran
tepuk tangan apresiasi puji tepuk tangan apresiasi puji,pujian
senang lancar jaya langsung sat set bikin faktur pajak keluar lupa simpan aman jaya unggah klik konfirmasi tanda tangan hening sukses simpan pemberitahuan sukses klik faktur pajak bersih faktur tau kayak mending langsung ganggu wajah merah marah marah hebat wajah merah marah marah hebat wajah merah marah marah hebat,keluhan
gue bilang sih benar gue tanggal jam siang layar putih,keluhan
capai,keluhan
tim investigasi admin daftar dapur dekat bidan,saran
badan usaha,keluhan
faktur batal batal minggu batal,keluhan
titip bakwan tangan angkat raya sukses,saran
moga gaji turun orang memilki kondisi ekonomi cukup picu senjang terima,keluhan
kemarin sekolah anak ikan dor,pujian
cirebon,keluhan
mundur anak desa butuh makan gizi tumbuh kuat sehat goreng politik lupa korupsi negara bangkrut,saran
bikin tutorial tutor,saran
langkah pimpin profesional bidang limpah ambil pensiun,keluhan
aktif akun dapat manfaat,saran
menang tertawa lucu menang tertawa lucu menang tertawa lucu menang tertawa lucu menang tertawa lucu,keluhan
lapor,keluhan
badan terima jalur buka lowong,keluhan
tuju program henti program bau korupsi mitra gabung kaki tangan kuasa al hasil nikmat siswa kuasa niat tuju kasih dana sekolah biar sekolah orang tua contoh jepang,saran
triliun bulan oi lucu kali susah gilir pajak,keluhan
wajib audit,saran
impor pagi,keluhan
hai admin klinik jam orang umum istirahat parah banget orang bijak klinik,keluhan
keren,pujian
buka lowong kerja mati usaha dagang dagang sekolah menang sedih,keluhan
set malam proses lapor menang sedu sedu sedih ekstrem,keluhan
menang menang sedih,keluhan
seko,keluhan
aplikasi,keluhan
jam pagi makan antuk ajar jam siang,keluhan
sistem sehat sih sakit kemarin,keluhan
keren sakit asuransi swasta tolak terima mata hati cinta gila gila banget sih tepuk tangan apresiasi puji,pujian
[BADWORD] lapor banget culas fakta racun ribu korban ng klaim hasil,keluhan
buka dapur seko,saran
botak [BADWORD],keluhan
antre aplikasi,keluhan
not,keluhan
mantap jempol tuju bagus,pujian
heran heran anggar,keluhan
polemik cek vendor vendor dapur,keluhan
betul bubuh tanda surat otorisasi terbit terbit on menang sedih parah sumpah,keluhan
jam,keluhan
langkah penuh semangat,pujian
gaji bayar habis sabar mogok kerja,keluhan
admin becus kerja urus gaji selesai selesai orang tagih hutang didik pasu dasar instansi [BADWORD],keluhan
halo admin barusan ganti klinik urus kartu fisik kartu fisik tulis klinik,saran
senang banget lihat anak anak sekolah makan kayak pas sekolah suka tega teman makan jajan menang sedu sedu sedih ekstrem,pujian
menang sedih menang sedih,keluhan
sih tobat bikin dosa zalim pajak haram tambah dosa zalim,keluhan
bikin faktur pajak tumpuk kerja,keluhan
ganggu,keluhan
ayo unggah faktur masuk puter badan mau sebentar batas unggah faktur pajak keluar susah lapor unifikasi solusi kerja bayar pajak kayak sulit administrasi menang sedih menang sedih menang sedih menang sedu sedu sedih ekstrem menang sedu sedu sedih ekstrem program susah,keluhan
mata hati cinta gila gila mata hati cinta gila gila mata hati cinta gila gila mata hati cinta gila gila mata hati cinta gila gila,pujian
menang tertawa lucu menang tertawa lucu menang tertawa lucu,keluhan
tutup anak racun [BADWORD],keluhan
makan gizi gratis makan busuk gratis makan racun gratis,keluhan
selamat siang admin jalan alami lapor bayar bukti potong rekam unifikasi pegawai alami gagal proses bayar lapor sal data proses tunggu menit hari bayar lapor unifikasi pegawai non proses rekam bukti potong tanggal dokumen pilih salah pilih tanggal dokumen rekam tulis edit ulang kali ulang ulang mohon tindak tangan doa mohon terima kasih syukur,keluhan
admin lapor menang sedu sedu sedih ekstrem iya kena denda bikin stres kali besok suruh pikir lapor,keluhan
ambil antre,keluhan
wakil kepala pusung tenang nasib gaji langsung didik laptop motor listrik seragam,saran
gaji gaji,keluhan
dapur damai ganggu berisik buang [BADWORD] sih tong [BADWORD] bau jijik pegawai berisik karuan pegawai pria wanita rokok nongkrong rumah orang sembarang ganggu bikin dapur sewa rumah sewa mukim warga pohon alas dapur,keluhan
sunat dana didik,keluhan
serah capai stres urus atas kerja apa atas terima sabtu minggu libur kantor stres depresi menang sedu sedu sedih ekstrem menang sedu sedu sedih ekstrem,keluhan
susah karyawan olahraga kali,keluhan
menang tertawa lucu menang tertawa lucu apa beda iklan obat kasihan wajib pajak keluh jaman biasa keluh tau asli,keluhan
sinkron data menang tertawa lucu,keluhan
labil ubah bikin sistem atur pikir praktik lapang ubah atur muncul atur panjang,keluhan
keren mata hati cinta gila gila,pujian
moga perut busuk koruptor proyek,keluhan
musibah hadap sabar salat,saran
admin daerah pindah puskesmas antre layan judes sih perintah henti rakyat,keluhan
beda sekolah gue,keluhan
admin daftar eror isi alamat camat lurah opsi klik manual buka laptop,keluhan
terima kasih informasi admin,pujian
mantap tangan angkat raya sukses,pujian
indikasi bekas pakai,keluhan
ganti nomor telepon ribet perintah nih urus susah ujung gagal mesti banget kantor layan urus perintah,keluhan
status gaji benar telat bayar,saran
kok kasih jabat [BADWORD] [BADWORD],keluhan
gaji gaji engkau,keluhan
mudah batal atur tepuk tangan apresiasi puji tepuk tangan apresiasi puji tepuk tangan apresiasi puji,keluhan
otak,keluhan
konten edukasi pajak dagang wacana tunda tunda dagang bayar pajak bayar pajak sembari tunggu bayar pajak pakai kode setor mbok iya lo,saran
