text,label_pks
halo admin sistem ribet rujuk puskesmas langsung rujuk mesti ribet orang sakit sakit mending orang sehat surat rujuk sehat ribet kasihan orang obat kacau nih kayak,keluhan
admin,keluhan
tepuk tangan apresiasi puji tepuk tangan apresiasi puji mantap edukasi,pujian
[BADWORD] haris eror menang sedih,keluhan
keren info tepuk tangan apresiasi puji,pujian
kemarin kemarin,keluhan
suruh bayar pajak aplikasi susah akses benar verifikasi email hari masuk gilir kantor pajak suruh baru,keluhan
keluh baca sih hormat menang sedih menang sedih menang sedih menang sedih paham menang sedih menang sedih,keluhan
eror oi,keluhan
ganti,keluhan
admin barusan log in nik,keluhan
admin aktif mohon balas,saran
kerja sistem ampun,keluhan
zero eror kasih uang,saran
mata hati cinta gila gila mata hati cinta gila gila mata hati cinta gila gila mata hati cinta gila gila mata hati cinta gila gila mata hati cinta gila gila,pujian
sumpah in tanggal april subuh set jam malam menang faktur maret sih menang sedih menang sedih menang sedih menang sedih,keluhan
oi sih,keluhan
muncul dokumen pajak masuk status nilai nol dokumen nilai solusi ulang manual anggap valid,keluhan
tepuk tangan apresiasi puji,pujian
anak coba,keluhan
[BADWORD] telepon angkat,keluhan
hasil validasi nomor surat sistem bunyi nomor suket temu menang sedih,keluhan
tega menang sedih,keluhan
mundur program program lahan korup [BADWORD] racun selo bicara sekian sekian laknat haram gaji,keluhan
tanya web gampang akses pamer menu masuk susah,keluhan
moga genjot pelosok kasihan sekolah rasa dapur banyak daerah padat mukim menang sedih,saran
tolong pikir batas bikin faktur pajak lapor astagfirullah karyawan rakyat hobi susah senyum menang bahagia sedih lega wajah gigit bibir juang keras frustrasi,keluhan
tangan angkat raya sukses,pujian
kota kakak,saran
masak jam pagi makan jam siang masak jam malam makan jam siang keburu basi racun,saran
menang bu ambil ulang menang tertawa lucu menang tertawa lucu menang tertawa lucu menang tertawa lucu,keluhan
menang tertawa lucu menang tertawa lucu menang tertawa lucu menang tertawa lucu menang tertawa lucu,keluhan
pakai bayar daftar jawa gilir pindah bal pakai aktif bayar bulan bayar,keluhan
gaji bayar cair gaji,keluhan
teret kelas raja ng,keluhan
[BADWORD] mu lay,keluhan
sistem lapor tahun,keluhan
semangat lanjut,pujian
bikin stres [BADWORD] menang sedu sedu sedih ekstrem menang sedu sedu sedih ekstrem menang sedu sedu sedih ekstrem kepala ledak kejut percaya kepala ledak kejut percaya kepala ledak kejut percaya,keluhan
sih faktur keluar hilang coba kemarin santai lega damai,keluhan
stop program habis dana racun,keluhan
bayar admin gilir tangan adu suruh unggah foto ironis obat pasang larang ambil foto video adu masuk,keluhan
susun web susah menang sedu sedu sedih ekstrem,keluhan
jelek post bagus doang post ampun,keluhan
anak racun admin,keluhan
gun sistem in cepat baik,keluhan
kakak admin cek,saran
awas seksama program puji mulia serah,pujian
tepuk tangan apresiasi puji tepuk tangan apresiasi puji,pujian
korban racun diri,keluhan
buket bunga hadiah selamat,pujian
menang tertawa lucu menang tertawa lucu admin artis pamer harta menang tertawa lucu menang tertawa lucu,keluhan
batas bayar nih,keluhan
racun fitnah [BADWORD] ha unggah [BADWORD],keluhan
gaji admin bayar keringat,keluhan
edit,keluhan
kembali,saran
anti korupsi korupsi,keluhan
bikin konten keren kayak aplikasi jelek,keluhan
bikin mandiri kakak,saran
sehat batas admin maksimal,saran
masuk mati verifikasi email verifikasi,keluhan
admin,keluhan
dah telat indonesia santai buru menteri uang [BADWORD],keluhan
aplikasi kusut konsultasi ar [BADWORD] ajar ajar aduh negeri aneh orang bayar pajak sulit sistem,keluhan
lot ecek,keluhan
admin keluarga minggu aktif tanggung aktif tanggung,keluhan
terima kasih bantu sehat moga program tambah moga masyarakat oleh manfaat,pujian
ku aktif pakai,keluhan
admin tingkat daftar obat puskesmas kartu pakai ubah,saran
alhamdulillah manfaat,pujian
cek daerah sarang rembang menu banget banyak korupsi menu soto ayam bening anggur keripik tempe keping menang tertawa lucu gizi keripik tempe,keluhan
perintah ri jelas bayar biar masuk karyawan jalur titip jalan edit sistem,keluhan
kayak iya,saran
tepuk tangan apresiasi puji tepuk tangan apresiasi puji tepuk tangan apresiasi puji,pujian
orang orang kode gue buka web,keluhan
yuk yuk benah moga cepat sanksi masalah,saran
capai kali kali tagih iur tinggal terang tinggal dunia lapor kantor media sosial rekan tagih tagih capai banget sumpah,keluhan
coba komen,saran
anggar kerja nihil menang tertawa lucu,keluhan
jadwal dokter estimasi sambung dokter,keluhan
impor unifikasi hasil eror kemarin pagi skema impor,keluhan
menang tertawa lucu,keluhan
negeri maja selatan majalengka makan gratis admin,keluhan
oi dad mundur bangka malu,keluhan
pajak kuat indonesia maju lengan otot kuat semangat lengan otot kuat semangat lengan otot kuat semangat,pujian
salah badan korup aplikasi [BADWORD],keluhan
selesai moga cepat selesai,keluhan
kerja tunggu tau doang tau sih bentar rilis suruh pakai kasih kasih karyawan ajar paham alah kayak karyawan pajak ikut kesal imbas lo,keluhan
admin laku urus mati bikin kelas admin,keluhan
negeri takut jago kandang doang,keluhan
kenan lapor praktik layan sehat etis salah rumah sakit swasta kota bekas orang tua pasien guna sehat pulang rawat rumah sakit klaim kondisi pasien stabil layak rawat rumah fakta medis bukti bawa pulang orang tua langsung pindah rumah sakit rumah sakit beliau rawat kota bekas kondisi turun ventilator kisah puncak gunung es alami pasien mohon sehat tindak rumah sakit tinjau ulang regulasi masyarakat pasien guna korban praktik intervensi perintah pusat adil tegak perhati tindak cepat ucap terima kasih tangan doa mohon terima kasih syukur,keluhan
hidup,pujian
buka menang sedu sedu sedih ekstrem menang sedu sedu sedih ekstrem menang sedu sedu sedih ekstrem,keluhan
kendala bantu tepuk tangan apresiasi puji,saran
menu susu admin,keluhan
baca komen,saran
halo admin nih kelas hapus balas,keluhan
manfaat,pujian
anak ayah bahaya bikin berita media penuh menang tertawa lucu,keluhan
gaji isi bilang gaji cair tanggal tanggal cair cair tunggak pikir staf lapang,keluhan
bintang nilai baik admin cape banget,keluhan
pajak zalim,keluhan
besok faktur selesai,saran
halo admin ahli baik,keluhan
tepuk tangan apresiasi puji tepuk tangan apresiasi puji mata hati cinta gila gila mata hati cinta gila gila,pujian
menang sedu sedu sedih ekstrem menang sedu sedu sedih ekstrem menang sedu sedu sedih ekstrem,keluhan
ampun kena strok,keluhan
jamin,saran
kartu aplikasi,saran
admin pas impor nilai cocok jelas admin,keluhan
atur kak,saran
kaji ulang biar racun,saran
detik eror wajah gigit bibir juang keras frustrasi orang kerja sabtu minggu senin selasa lo tunda kerja sistem tepuk tangan apresiasi puji tepuk tangan apresiasi puji tepuk tangan apresiasi puji nih,keluhan
tanggal hambat kerja gara gara sistem senyum menang bahagia sedih lega,keluhan
keren indonesia emas,pujian
gaji pergi kerja pakai air pakai minyak hutang menang sedih,keluhan
orang kerja eror tim kerja malam pagi jam kerja ganggu,keluhan
besok gedung dana makan rapat gedung,keluhan
pokok tepuk tangan apresiasi puji tepuk tangan apresiasi puji,pujian
ananda,saran
ribu komentar kritik saran dengar,keluhan
keren bantu,pujian
masuk sesuai tanggal juni juli bayar sesuai tanggal iya gaji terima sesuai kontrak usaha bayar sesuai surat janji kerja tolong harga kerja lapang ahli gizi rekan jawat beban kerja iya telat nominal sesuai bayar adu apa wadah adu adu forum buka akun kayak jarang baca komen telusur kerja bayar kacau banget,keluhan
jam akses [BADWORD],keluhan
panjang rujuk bikin repot ubah,saran
korup to mata hati cinta gila gila,keluhan
gaji karyawannya macet,keluhan
aktivasi jempol tuju bagus,pujian
cek admin,saran
yuk aktivasi akun,saran
titip,keluhan
buah stroberi makan enak buah stroberi makan enak buah stroberi makan enak wajah kucing cemberut marah,keluhan
tangan angkat raya sukses tangan angkat raya sukses tangan angkat raya sukses,pujian
web paksa luncur,keluhan
mbok benar jaman manual tambah susah,keluhan
terima kasih cerah dok,pujian
bongkar pasang nih judul,saran
admin impor data klik menang sedu sedu sedih ekstrem menang sedu sedu sedih ekstrem menang sedu sedu sedih ekstrem sistem menang sedu sedu sedih ekstrem,keluhan
tindak makan racun racun ribu orang legal,keluhan
validasi menang tertawa lucu sumpah nih pajak main,keluhan
tanggal masuk,keluhan
mata hati cinta gila gila mata hati cinta gila gila mata hati cinta gila gila mata hati cinta gila gila,pujian
kerap selasa,keluhan
ayo aplikasi mu ojok eror sumpek,keluhan
lawan,saran
nih,keluhan
moga kelola guna utama,saran
bobrok bongkar menang tertawa lucu,keluhan
puter,keluhan
baik,saran
eh botak kepala pupuk rambut,keluhan
cape cape boikot teken,keluhan
anak kasih makan bapak rumah cari kerja anak seko kenyang bapak juang tahan lapar coba nafkah layak keluarga menang sedih menang sedih menang sedih menang sedih,keluhan
buset kerja,keluhan
jam pagi jam malam akses tim pusat pulang tim pusat deh buka mata senyum pipi rona senang puas,keluhan
hapus rawan racun,keluhan
halo cek,saran
admin kelas mandiri kelas rawat inap,saran
serah,keluhan
admin konsultasi cepat kota obat kasih suruh ambil tanggal tanggal kota ambil obat kasih suruh daftar konsultasi ulang dokter suruh tunggu jadwal jadwal tanggal sekian minggu obat farmasi sepele sedih admin,keluhan
mati sih racun ribu,keluhan
lokasi lamar penuh orang banget sumpah sih daerah open biar,keluhan
server solusi bu menang tertawa lucu,keluhan
tangan angkat raya sukses,pujian
gaji juli september bayar,keluhan
layan kantor pajak kabupaten aceh jaya kayak [BADWORD],keluhan
mohon info aktif serta tangguh bayar,saran
tepuk tangan apresiasi puji,pujian
pegawai nik karyawan sangkut ribet coba bantu registrasi kendala langkah isi detail alamat tulis jangkau solusi admin,keluhan
apa kondisi pegawai pajak cuti menang tertawa lucu,keluhan
info umum lomba,saran
terus juang sempurna layan maju,pujian
daerah layan sehat milik atur sendiri laku salin,saran
sengaja biar telat bayar oi lot banget,keluhan
nonaktif,saran
jempol tuju bagus jempol tuju bagus jempol tuju bagus,pujian
milad,pujian
keluar atur mending kompensasi bikin pening,keluhan
akses,keluhan
data pelintir zalim besok akhirat hukum orang zalim ngeri jari umpat paham,keluhan
program dampak keluarga,keluhan
terima kasih informasi tangan doa mohon terima kasih syukur tangan doa mohon terima kasih syukur,pujian
makan siswa jam sore menang tertawa lucu,keluhan
ku menang sedu sedu sedih ekstrem menang sedu sedu sedih ekstrem menang sedu sedu sedih ekstrem menang sedu sedu sedih ekstrem,keluhan
bikin susah data kait kakak meni nomor kakak valid status istri susah verifikasi aneh buat jasa liar,keluhan
[BADWORD],keluhan
menang sedih,keluhan
masyaallah bingung tanggap,keluhan
nomer baca om,keluhan
mental potong cocok jabat cocok gunting kertas,keluhan
bulan menang tertawa lucu,keluhan
lengan otot kuat semangat,pujian
[BADWORD] [BADWORD],keluhan
[BADWORD],keluhan
juni wilayah aceh terima gaji mohon tunjuk admin tangan doa mohon terima kasih syukur,keluhan
info dok tangan doa mohon terima kasih syukur,pujian
situs kayak [BADWORD] bikin susah masyarakat suruh alamat henti ulang verifikasi no telepon pakai pulsa parah,keluhan
buka putar paham kenal orang,keluhan
sehat tepuk tangan apresiasi puji tepuk tangan apresiasi puji tepuk tangan apresiasi puji,pujian
keren jelas,pujian
ribet terima wa akun real amanah,saran
kepala orang,keluhan
admin lapor admin tanggal,keluhan
paksa perintah pakai konten sesat,keluhan
baik mohon baik komentar,keluhan
alhamdulillah keren,pujian
terima kasih jari hati cinta korea pop,pujian
pegawai tempat latih layan prima bagus,saran
janji gaji,keluhan
selamat ulang sehat tangan bentuk hati cinta dukung,pujian
tepuk tangan apresiasi puji tepuk tangan apresiasi puji,pujian
kirim foto komen,keluhan
pajak keluar malam salah menang sedih,keluhan
wa nomer adu adu masyarakat sesuai fakta catat belaka lendir sayur tindak tindak pusat adil sosial rakyat indonesia,saran
sial,keluhan
tanggal server bikin susah,saran
susah buat aktivasi akun real amanah orang badan koperasi,saran
bantu anak butuh hasil kerja,pujian
semangat rawan moga program angka anggur miskin kurang daerah lengan otot kuat semangat lengan otot kuat semangat,saran
lucu,keluhan
bangga,keluhan
bismillah allah mudah tim indonesia program presiden mulia anak generasi terus bangsa indonesia amin wajah senyum lingkar cahaya polos niat tangan bentuk hati cinta dukung,pujian
aduh web banget admin admin ulang,keluhan
tombol lapor bayar tombol konfirmasi tanda tangan,keluhan
fungsi pajak pungut masyarakat kaya jabat [BADWORD],keluhan
minimal buka layan bagus sikit masuk banget,keluhan
hiu saus tomat,keluhan
rujuk pol beda beda tanggal beda,saran
cek kolesterol palembang jamin hasil apotik bawa pulang obat,keluhan
sebentar masuk oktober telantar hak situasi pegang dapur peduli hak,keluhan
moga baik depan,pujian
yuk aktivasi akun urus pajak,saran
lupa email no,saran
pasien kondisi khusus pasi baya mandiri rawat pasien rawat atur,keluhan
kocak kocak gaji cak,keluhan
admin pindah tingkat admin tunggu minggu,saran
moga musim lapor via jalan lancar musim lapor,pujian
terima kasih,pujian
benar,keluhan
sosialisasi ubah atur layan sehat gigi bentur masyarakat,keluhan
pakai tarik langsung,keluhan
nasi,keluhan
video bicara minum susu liter bikin post akun bang,keluhan
kerja tumpuk sistem keluh masyarakat dengar maki pakai ajak ribut banget,keluhan
kabupaten serang menu ayam telur ayam telur variasi menang sedih kadang bau biar rata kayak foto senjang,keluhan
hai admin rujuk batal cantum riwayat data lanjut,saran
perintah swasta manajemen santai lega damai,keluhan
ah gara gara atur giat gue desember tagih,keluhan
logika masuk tugas layan salur makan gaji,keluhan
lapor kantor pajak langsung temu kendala,keluhan
mata hati cinta gila gila mata hati cinta gila gila,pujian
benar sistem,keluhan
balita langsung buat denda lahir [BADWORD] nominal ringan orang langsung timbang uang,keluhan
mantap,pujian
busung lapar,keluhan
aneh laku data data sasar,keluhan
untung sehat,pujian
empati menang sedih,keluhan
lapor admin tolong susah lot ampun tombol hilang fokus doang kerja urus doang bentuk gagal perintah gadang gadang mudah bikin staf sakit gara,keluhan
dok edukasi,pujian
jabat bemper,keluhan
tim rawan sehat sehat iya anak anak,pujian
hancur indah raja ampat uang,keluhan
pantau fail muncul angka baris kolom gagal,keluhan
aktivasi akun pas cari nama muncul ganggu,keluhan
assalamualaikum realisasi bangun dapur bangun,saran
verifikasi no susah banget,keluhan
gue mandiri aktif bayar eh zaman gubernur bayar pas kota gue ganti bijak bayar eh gue pusat aktif gue sih mas kerja status gue mandiri tb ubah izin perintah alas lurah gue tinggal gue pakai aktif beda gubernur putar mata bosan percaya putar mata bosan percaya serius gue dengar gue asuransi sehat swasta gue pusat operator bantu gue aktif gue gue pindah kadi gue mandiri gue gue kelas aktif bayar izin ubah serta perintah syukur mati guna,keluhan
wajib web iya aplikasi,saran
rim otak [BADWORD] [BADWORD] negara isi sarang tikus doang,keluhan
selamat ulang presiden gaji ag turun menang sedih tepuk tangan apresiasi puji mata hati cinta gila gila,pujian
kakak sabtu menu kebab susu kotak buah buah naga cirebon,saran
sabar perut lapar gaji,keluhan
susah bikin bapa,keluhan
enak terima komplain masyarakat pegawai butuh pakai marah atas langsung ancam sp menang tertawa lucu,keluhan
tutup berita buruk masif sebar berita saking buruk blunder tanda,keluhan
rakyat indonesia makan ada jabat makan lap emas pakai uang pajak rakyat aduh deh tau perintah menang tertawa lucu,keluhan
tindak perihal kendala tangan data pegawai instansi perintah tanggal oktober si log in menu submenu terbit bulan akses lapor minggu tindak aplikasi lamban klik baik layan,saran
jamin lapor tahun masalah bas juta tahun lapor,keluhan
eror tah,keluhan
[BADWORD] babi bikin sulit,keluhan
sepi,saran
dana tingkat kali uang korupsi pajak biar nyala korupsi tiada masalah suruh wajib pajak sistem wajib bagus,keluhan
tangan angkat raya sukses,pujian
admin maaf izin guna sehat perintah jujur edar informasi suruh orang daftar mohon maaf admin lenceng,saran
aduh bikin pusing doang,keluhan
tepuk tangan apresiasi puji tepuk tangan apresiasi puji,pujian
ri kepala badan gizi nasional kurang gizi makan gizi uang haram nyata [BADWORD] sih bawah kepala [BADWORD] kayak,keluhan
mata hati cinta gila gila mata hati cinta gila gila,pujian
gagal akses sistem aduh rembet menang tertawa lucu,keluhan
to ri cuil kasihan butuh gaji pasti tolong kerja usaha baik dapur menang sedih,keluhan
riwayat sehat wajib,keluhan
solusi aksi tindak menang,keluhan
alas tanggung ca turun untung manfaat pasien alas coba kejar profit,keluhan
mata kaca kaca penuh sentuh,keluhan
klik tombol telah buka,keluhan
karyawan pajak suruh ajar sabar,keluhan
sekolah menang sedih,keluhan
detik gaji hak rela tinggal kerja abdi badan gizi nasional,keluhan
sih sulah minimal riset susu liter hari kacau menang tertawa lucu,keluhan
admin tunggu,saran
kode verifikasi masuk email menang sedih menang sedih,keluhan
kayak,keluhan
aplikasi miliar,keluhan
benar web buk tangan doa mohon terima kasih syukur lapor solusi tangan doa mohon terima kasih syukur,saran
jaya,pujian
salam hangat sekadau kalimantan barat,pujian
bayar lapor [BADWORD] sih,keluhan
moga racun,keluhan
kerja sabtu email pagi tiket wa email balas,keluhan
pandai bicara lapang lihat langsung implementasi menang sedih,keluhan
komen nih,keluhan
cepat tau,pujian
alhamdulillah lancar akun ku jempol tuju bagus,pujian
jempol tuju bagus jempol tuju bagus jempol tuju bagus,pujian
umum lomba admin,saran
gratis batas maksimal obat bayar normal mulia jakarta atur kayak,keluhan
post menu dapur hem eh,keluhan
henti program racun masal program konyol bobrok indonesia belakang menang sedih,keluhan
asam lambung terima sakit main minim suntik kayak kayak tolak camat muntah darah bab darah parah obat asal main kambuh muntah darah bab darah opname sadar rasa sakit muntah darah bab lemas pusing minggu catat pulang drop masuk asam lambung pakai [BADWORD] [BADWORD],keluhan
paket lengkap,saran
email menang sedih,keluhan
admin ganti admin sih,saran
larang rekam kantor pajak tuju admin,saran
tepuk tangan apresiasi puji tepuk tangan apresiasi puji tepuk tangan apresiasi puji,pujian
racun bilang batas wajar pikir sekolah guna,keluhan
syarat sertifikat penuh syarat syarat unggah unggah dokumen kosong bohong sertifikat jamin racun pangan dapur sedia ribu porsi singkat terap instan latih besok langsung terap pikir sih kue salah awal,keluhan
admin cek,saran
kota jakarta efektif anak anak buang makan kaji,keluhan
mata senyum pipi rona senang puas,saran
sih minggu busuk banget bikin faktur alam,keluhan
pantau jam siang buka,keluhan
alah sok dia dia menang tertawa lucu,keluhan
mohon bantu hormat akses layar putih sulit lapor,keluhan
semangat juang nama program bagus pas sop resmi lahan paham nyawa selamat lambat laun sempurna,pujian
asli,keluhan
oi kode [BADWORD] gue tunggu gagal isi menang tertawa lucu,keluhan
bikin betul ubah,keluhan
jempol tuju bagus jempol tuju bagus jempol tuju bagus,pujian
alah orang,keluhan
sistem rekrut murni ribu dadak muncul baik kualitas ribu aneh kasihan ribu juang ketimbang kait dapur gaji dahulu alas sodor kian marak kurang tingkat internal fokus tambah salah satu,keluhan
ubah atur menang sedu sedu sedih ekstrem,keluhan
dana korupsi program,keluhan
ayo aktif,saran
deli serdang menang sedih tangan angkat raya sukses,keluhan
tepuk tangan apresiasi puji tepuk tangan apresiasi puji,pujian
unduh lawan transaksi kemarin,keluhan
assalamualaikum kakak mohon arah coba daftar kak kak,keluhan
pencet keluar status hitung nilai,keluhan
jam kerja [BADWORD],keluhan
aplikasi,keluhan
tolong lapor faktur keluar,keluhan
benar minggu tumpuk batas tanggal robot kali menang sedu sedu sedih ekstrem,keluhan
tombol kirim bayar bulan sistem sempurna,keluhan
info admin jempol tuju bagus,pujian
tepuk tangan apresiasi puji,pujian
andai kayak,keluhan
malu dana suka melulu tuntut wajib pajak taat pajak suka lot,keluhan
informasi tangan angkat raya sukses,pujian
tim hati baik coba buka web sih merah lapor wajah hati cinta wajah hati cinta wajah hati cinta wajah hati cinta wajah hati cinta wajah hati cinta wajah hati cinta wajah hati cinta wajah hati cinta wajah hati cinta wajah hati cinta wajah hati cinta wajah hati cinta telat intip malu malas,saran
otak februari terbit gelut deh menang tertawa lucu,keluhan
admin tambah premi ina putus biar advokasi protes,saran
aktivasi,keluhan
tepuk tangan apresiasi puji tepuk tangan apresiasi puji,pujian
mampir cari teman lapor menang tertawa lucu jaga terbit sih terbit,keluhan
bu,pujian
buka daftar wajah leleh panas canggung,keluhan
tepuk tangan apresiasi puji tepuk tangan apresiasi puji tepuk tangan apresiasi puji tepuk tangan apresiasi puji,pujian
baja,keluhan
puter kayak kitir,keluhan
admin daerah kabupaten bogor makan siang gratis nih rata,keluhan
sih,keluhan
waspada anak anak makan anak tk nasi kotak bau basi,keluhan
yuk,saran
bikin anjir mau coba wajah merah marah marah hebat wajah merah marah marah hebat wajah merah marah marah hebat,keluhan
admin mutih,saran
maksud sih,keluhan
dapur karyawan ambil saudara kerabat dekat dapur yayasan kepala main kejar angka dapur operasional heran racun,saran
program cocok kayak sekolah negeri sedia kantin,saran
menang tertawa lucu menang tertawa lucu menang tertawa lucu menang tertawa lucu menang tertawa lucu menang tertawa lucu menang tertawa lucu,keluhan
ngeri ah gaji pulau sumatra kunjung bayar rapat dengar perihal pasti gaji,keluhan
data solusi edit ganti isi sesuai hapus dok mohon solusi,keluhan
indonesia beli asuransi perintah obat sakit batas menang tertawa lucu menang tertawa lucu menang tertawa lucu,keluhan
kirim,saran
kak,keluhan
bayar lapor pajak sistem hancur kode verifikasi email sms masuk masuk buset,keluhan
enak banget,pujian
admin kimia duren sawit hari minggu tutup obat puskesmas suruh bayar pakai gilir puskesmas camat makassar gratis pungut biaya adu tindak lanjut admin beda beda atur salah puskesmas admin laku doang tindak lanjut,keluhan
kolom isi gagal data at level is invalid solusi,keluhan
admin bayar iur baik sistem,keluhan
bikin aplikasi kemarin bikin susah astaga tanggal gin eror telat bayar kena denda asli bikin repot,keluhan
gaji,keluhan
gaji alas kali,keluhan
kak bar non aktif aktif aktif,keluhan
skor sempurna bagus,pujian
pahala bayar iur pakai saudara sakit bantu bayar rumah sakit jalan lancar tolak pasien aktif,saran
jempol tuju bagus,pujian
wajib kena sih bikin stres faktur tombol pergi gaib atur tabrak tobat puas bikin donatur negara puyeng mudah banget ganti atur negara bos main monopoli heran menang sedih,keluhan
ku,keluhan
tepuk tangan apresiasi puji tepuk tangan apresiasi puji,pujian
vaksin apa bon wajib masyarakat indonesia agenda elite global kontrol populasi dunia,keluhan
aduh selesai,keluhan
karyawan menteri,keluhan
teman musuh nih kias tragedi,saran
informasi tangan angkat raya sukses,pujian
cek admin,saran
kantor,saran
asalamualaikum rawat inap takut biaya mahal rawat inap takut hilang tanggung sehat tangan doa mohon terima kasih syukur,pujian
izin tombol muncul solusi,keluhan
tanggal agustus rujuk obat bulan baik sistem,keluhan
iya,saran
isi format sesuai isi nik,saran
manfaat,pujian
ayo,pujian
gaji ag gaji ri,keluhan
lapor deposit kurang malu koar suruh lapor lihat aplikasi deh,keluhan
panik spam,keluhan
mohon izin gaji sesuai sop taat atur pusat info gaji simpang siur usaha kuat bisa pinjam penuh butuh hari mohon perhati bu,keluhan
pas simpan foto suruh ganti lihat email kirim menang sedih,keluhan
aktivasi,pujian
geram banget baca berita badan gizi nasional erti gizi,keluhan
admin kali batas maksimal cek sehat hamil rumah sakit,saran
fokus anak wilayah pencil anak ekonomi bancak anggar negara,pujian
web [BADWORD],keluhan
mata hati cinta gila gila,pujian
map tampil terus isi borang,keluhan
gue pindah sekolah sekolah gue tempe tepung [BADWORD] menang sedu sedu sedih ekstrem menang sedu sedu sedih ekstrem menang sedu sedu sedih ekstrem enak sih,keluhan
pencet tombol masak mi habis mi muncul,keluhan
kang parkir umrah id bayar pajak nyala,keluhan
admin,keluhan
rubah oi erti susah kayak,keluhan
tombol edit informasi hilang tambah putar mata bosan percaya,keluhan
badan genosida nasional,keluhan
tres hadap wajah merah marah marah hebat,keluhan
oi revisi pakai nilai susah bayar,keluhan
keluar moga main duit,saran
mohon banget ponakan tunggu tangan tumor ganas tutup area anus ponakan susah,keluhan
kayak kenal,keluhan
sepi menang tertawa lucu,keluhan
bilang unggah muncul invalid apa merah doang takut unggah unggah ulang ketik manual,keluhan
tombol impor data keluar klik admin kerja minggu korban kumpul keluarga lot akses,keluhan
porsi,keluhan
gaji gaji,keluhan
bayar geser orang menang tertawa lucu negeri,keluhan
telat banget baru tutorial benar,keluhan
aduh banget mah,keluhan
admin minggu lupa usaha menu lupa sandi langsung kantor pas kantor satpam bilang ganggu admin bagus butuh banget,keluhan
kepala ahli gizi patung moa objek,keluhan
cuki gaji,keluhan
ri tuntut dapur masalah pidana penjara,keluhan
eror,keluhan
gaji duh kasihan latih kemarin jual jual kerja makan pinjam kasihan,keluhan
tangan angkat raya sukses,pujian
tepuk tangan apresiasi puji,pujian
maling,keluhan
moga laksana,pujian
