text,label_pks
admin hormat lelah saban bangun pajak admin pagi admin lelah hati admin,keluhan
ubah serta kak,saran
kasih,keluhan
pagi bikin faktur susah sih menang sedih menang sedih,keluhan
gaji keluar oi,keluhan
dirgahayu,pujian
sekolah gue jam pulang jir,keluhan
teman kerja nih,keluhan
jam siang upacara [BADWORD] matahari sengat [BADWORD],keluhan
siang akses mental sekali eror tolong tanggal menang sedih menang sedu sedu sedih ekstrem,keluhan
lihat berita positif berita siswa racun vendor bayar koreksi salah tangan doa mohon terima kasih syukur,keluhan
admin data final data sesuai menu impor admin,saran
[BADWORD],keluhan
labil kocak,keluhan
sekolah anak ku menu telur rebus ayam goreng lalap rebus,keluhan
laku inspeksi dadak badan gizi nasional duga korupsi kolusi nepotisme,saran
admin,keluhan
informasi manfaat terima kasih sehat jaya,pujian
halo admin ganggu daftar antre,keluhan
info,pujian
hari habis doang sakit gara menang sedu sedu sedih ekstrem,keluhan
kakak buka tangan doa mohon terima kasih syukur,saran
tara,keluhan
bikin ajar anggar bikin aplikasi [BADWORD],keluhan
admin basi jember mohon tindak diam,keluhan
gaji ri ri elite gaji malan anak istri anggar susah tinggal gaji anak istri nafkah pikir bingung cari uang jual motor,keluhan
ih takut,keluhan
terima kasih info,pujian
terima kasih negara hadir lindung rakyat program tepuk tangan apresiasi puji,pujian
daftar anak kemarin hasil cek lab,keluhan
sehat kilau ajaib,pujian
gaji cair tangan angkat raya sukses,keluhan
tepuk tangan apresiasi puji,pujian
aktivasi akun pajak sukses skor sempurna bagus,pujian
allah menang sedih menang sedih,keluhan
lulus,keluhan
admin cek serta anak anak aktif daftar tau nomor iur tagih jalan bayar admin cek,saran
makan enak,keluhan
set verifikasi masuk aduh patuh sistem,keluhan
karya nyata bangsa tangan angkat raya sukses dirgahayu,pujian
cape banget pagi banget faktur januari lapor ampun deh dosa sulit orang menang sedih menang sedih menang sedih,keluhan
kode,keluhan
paksa pakai pakai aplikasi sok ganti pakai,keluhan
web benar teman nama pegang,keluhan
tepuk tangan apresiasi puji tepuk tangan apresiasi puji,pujian
ahli serangga kepala badan gizi nasional fakta tepuk tangan apresiasi puji,keluhan
prabumulih timur,pujian
racun,keluhan
keluar manual unggah pilih tanggal otomatis ter set ganti klik,keluhan
kerja dapur kerja jam sesuai usaha makan gizi bikin makan perhati sehat jam bayar lembur langgar atur jam kerja bayar lembur kerja kerja jam percaya yayasan kelola dapur manajemen beranta kerja paksa jam kerja uang lembur sehat pegawai prihatin personel usaha personel irit kerja paksa kerja makan turun keteter,keluhan
capai capai eror kerja tumpuk pikir orang kerja,keluhan
isi kayak mata senyum pipi rona senang puas,keluhan
bayar status ubah admin hati patah sedih hilang cinta,keluhan
top jempol tuju bagus,pujian
kode verifikasi masuk admin,keluhan
ri serta lolos lolos sistem bukti an ayo kasihan ongkos kesana kemari,keluhan
bu cek [BADWORD] terima setor rupiah dapur setor jatah hak mitra sewa sekian rupiah jatah pakai orang kumpul periksa periksa periksa bu biang kerok,saran
ayo mas mbak sis tinggal aktif akun mu mata hati cinta gila gila mata hati cinta gila gila mata hati cinta gila gila,saran
akting hebat bunda [BADWORD] menang tertawa lucu,keluhan
admin allah menang sedih,keluhan
aktivasi akun jempol tuju bagus,saran
terima kasih info admin,pujian
jaya benah,pujian
semangat dek semangat juang gaji,pujian
juni potong tk jp juli potong tk jp terima tanggal juli naik tangan doa mohon terima kasih syukur,keluhan
stop pakai lot sebentar aplikasi hilang timbul bikin ulah wajib pajak kerja,keluhan
admin pindah,saran
lapor admin menang sedih,keluhan
admin aplikasi pindah kelas kelas pakai rawat inap kelas admin,saran
omong kosong,keluhan
aplikasi pajak sebentar,keluhan
susah,keluhan
oi benar gue kerja,keluhan
urus pajak nyala,pujian
dirgahayu,pujian
admin bayar deposit pas klik muncul lapor tunggu bayar deposit fitur bayar pakai deposit admin aneh banget lapor sulit,keluhan
cape deh non efektif abai tagih pajak lupa,keluhan
dad sih ahli serangga,keluhan
buncit sehat,keluhan
program makan kacang hijau syukur anak hidup desa beli jajan program makan kacang hijau syukur program makan gizi bantu anak pelosok desa lihat salah lihat manfaat hasil,pujian
nyata jadi,keluhan
admin ambil nomer antre aplikasi susah coba kasih solusi tangan doa mohon terima kasih syukur,keluhan
alhamdulillah maju milik peran ekonomi nasional serap tenaga kerja dorong perata ekonomi pondasi ekonomi rakyat sukses ri,pujian
bayar masuk pajak budiman menang sedih,keluhan
admin maaf daftar rekam medis rujuk daftar rujuk isi rekam medis kakak,saran
bikin tahap,keluhan
semangat presiden moga niat baik realisasi oknum nakal,pujian
ganti bijak susah rakyat anak pas derajat anak anggap gawat bayar balik bijak gawat kayak bayar hutang bayar bijak susah rakyat,saran
nila,pujian
koyok kenek menang tertawa lucu,keluhan
triliun bulan bagi makan gizi gratis,keluhan
bikin sistem [BADWORD],keluhan
susu air kasih ha,keluhan
kak cek,saran
cinta,pujian
lulus uji,keluhan
bikin,keluhan
tampil baru blok sistem baik bikin sistem mudah sulit aktivasi akun lupa email kantor pajak,saran
menang tertawa lucu,pujian
sistem sih solusi bikin ruwet doang,keluhan
tres kerja tumpuk,keluhan
banyak syukur ayo syukur kasih allah sehat hirup oksigen gratis bayar iur sehat sedekah bantu pilih bayar iur rutin kasih sehat bayar iur hirup oksigen bayar operasi cuci darah kondisi depan bismillah sehat moga sakit sembuh amin lengan otot kuat semangat,saran
buk cerita lulus lulus,keluhan
kak coba kasih susu,saran
kasih tutor server mu baik tidur air liur ingus antuk bosan,keluhan
kode konsep lanjut biar kode muncul me menang sedu sedu sedih ekstrem menang sedu sedu sedih ekstrem,keluhan
tim kode masuk ulang kali kirim verifikasi no telepon habis pulsa gue kembali uang bikin uh,keluhan
nih orang mulut mbok jaga lisan sakit orang suruh sehat negara sakit blog,keluhan
layan oke tepuk tangan apresiasi puji,pujian
sertifikasi umu indonesia uang laku apa sertifikasi tutup akar problem dalam,saran
ribet,keluhan
aplikasi baru terang nik salah nik salah mohon baik sistem,keluhan
admin suami daftar anak daftar mandiri anak admin,keluhan
sih menang sedu sedu sedih ekstrem,keluhan
lapor tiket adu sistem melati februari suruh tunggu email lapor batas lapor undur bu,keluhan
mata hati cinta gila gila mata hati cinta gila gila mata hati cinta gila gila,pujian
tanda oke sempurna tanda oke sempurna tanda oke sempurna,pujian
bicara pajak pajak atur cong [BADWORD] doang,keluhan
bintang nilai baik bintang nilai baik bintang nilai baik,pujian
admin sih atur lahir normal,saran
iur kelas,saran
admin,saran
turun lapang menang tertawa lucu,saran
benar benar,keluhan
akun kali,saran
sertifikat lembar,saran
admin balas,saran
pajak,saran
kerja status sehat aktif terang aktif aktif maksud admin obat,saran
bikin olah kayak sinetron,keluhan
jasa raharja merger asuransi jasa raharja main,saran
aktif lapor keringat dingin khawatir sedih keras,keluhan
atur timpa biasa jalan atur,keluhan
tinjau atur keluar rujuk ancam putus panjang rujuk sahabat rujuk pasar minggu spesialis jantung laku oktober atur pikir,keluhan
benar kali temu eror diskon hitung nilai sesuai impor contoh data impor hasil tarik sistem akibat cari selisih makan,keluhan
kocak ganti malu,keluhan
gigi tahun tunggu indikasi medis indikasi medis alas estetika anjur dokter gigi tahun,keluhan
gaji gaji fokus pikir uang gaji pikir fokus awas kontrol nyata lapang coba periksa kasihan,keluhan
langsung muncul pembayan,keluhan
anggar gaji digit benar jam makan gaji [BADWORD],keluhan
habis terbit aneh aneh sakit target gue kerja gue jadwal gue rencana kerja realisasi kerja gue kacau dampak,keluhan
admin kemarin dokter bilang suruh operasi pas umur umur,keluhan
admin obat pasca adang,saran
tipu rakyat [BADWORD],keluhan
admin omset gunggung iya,saran
kode masuk email menang tertawa lucu,keluhan
bangga badan gizi nasional,pujian
makan sekolah wajah sedih kecewa,keluhan
operasi sebab racun juta terima manfaat terima manfaat dampak racun program kurang prihatin racun evaluasi buruk lanjut,saran
segar banget,pujian
cair dana kena biaya admin orang klaim admin info susah banget adu,keluhan
parah,keluhan
sih anggar tahun selesai kerja sih tikus,keluhan
seko,keluhan
jaga sehat tangan angkat raya sukses,pujian
admin status admin bantu informasi admin,saran
ganggu lihat lihat jam,keluhan
inspirasi admin tangan doa mohon terima kasih syukur,pujian
biar kena denda [BADWORD] banget sih ikhlas suruh bayar denda,keluhan
admin,saran
cari ajar banyak orang orang hancur,keluhan
pusing admin menang sedu sedu sedih ekstrem besok beda omong,keluhan
terima kasih informasi,pujian
fitur bagus,pujian
anak sekolah,keluhan
berani post resmi sih banget kayak,keluhan
mending obrol,keluhan
capai hati kerja tumpuk bikin mumet kayak parah februari mohon info resmi eror diam,keluhan
admin cek,saran
admin pasien rutin kontrol pol jantung rscm rujuk jenjang rscm info dokter rscm pasien rujuk langsung rscm urus rujuk langsung rscm info dokter sistem pilih rscm nih admin,keluhan
malu bu gontok nih vendor,keluhan
banget ribet lot eror,keluhan
halo admin bantu lapor,keluhan
bingung,keluhan
sih admin wajah lelah putus asa,keluhan
penak dodol kerupuk ning pasar urus,keluhan
info,pujian
pajak masuk cerita,keluhan
halo admin tunggak bayar bayar lunas cek terang pasuk denda tanggal sekian tanggal sekian maksud admin,keluhan
menang sedih,keluhan
admin dian terima serta moga cepat tolong biaya serta butuh cuci darah maju,pujian
sehat alami tunggak tahun rawat inap biaya peser masyarakat miskin bayar tunggak sehat dana,saran
bubar,keluhan
obral janji,keluhan
ayo,saran
kesal marah campur aduk,keluhan
banget korupsi uang kali dosa hak perut anak anak banget amanah banget baik bayang bahagia korupsi uang harga allah mudah,keluhan
admin,saran
admin akun anak umur wajah anak solusi admin,keluhan
warga indonesia suruh ajar keren bayi ajar menang tertawa lucu menang tertawa lucu menang tertawa lucu,keluhan
senjata biologis kata hasil menang sedu sedu sedih ekstrem,keluhan
muncul nomor,keluhan
menang sedih,keluhan
sak lelah hayati,keluhan
aplikasi lambat masuk akun akun usaha hari,keluhan
waras orang orang,keluhan
lapor menang sedih,keluhan
bikin ganti faktur pajak keluar data muncul,keluhan
salah anak korban racun heran ekspos serap tenaga kerja terima korban racun sepele,keluhan
lucu tingkat akurasi,keluhan
menang tertawa lucu menang tertawa lucu menang tertawa lucu menang tertawa lucu menang tertawa lucu menang tertawa lucu,pujian
bulan kendala masyarakat paksa maklum anggar bilang hasil luncur tangan,keluhan
struktural ganti orang kompeten bidang ganti egois sistem ketat ladang korupsi tender elite,saran
becus kerja mending gue daftar web busuk banget,keluhan
kak kakak keluarga beda bayar hitung kakak,saran
aplikasi masuk,keluhan
mohon alam guna laman in bawa pasien alas tugas validasi radius in tanya obat pasien pasien ganti validasi radius,saran
[BADWORD],keluhan
tangan angkat raya sukses,pujian
halo admin aplikasi ambil nomor antre,keluhan
menang sedih,keluhan
perintah tuntut wajib hak sungguh miris,keluhan
tukang serangga,keluhan
tata busuk,keluhan
banget sih,keluhan
budur,keluhan
pajak bis,keluhan
semangat juang,pujian
suruh,keluhan
presiden menteri uang perhati pulau jawa terima gaji jalan biaya hidup hari gaji keluar jalan perhati keluar gaji keluar gaji kabinet ri ri presiden,keluhan
lapor admin,saran
masuk jam siang jam pagi kira pas makan siang,keluhan
hai sih pas kerja,keluhan
jempol tuju bagus tangan doa mohon terima kasih syukur,pujian
laksana,pujian
gue klik kali kali faktur duplikat,keluhan
tangan angkat raya sukses tangan angkat raya sukses tangan angkat raya sukses,pujian
tau informasi baru hujat,keluhan
minggu log hambat kerja tangan doa mohon terima kasih syukur,keluhan
pindah mandiri kelas admin keluarga,keluhan
moga cepat akses pegawai swasta,keluhan
perintah kurang admin anak sakit periksa puskesmas desember kemarin gratis,keluhan
oknum perintah nyaman main kelompok serakah cipta rantai distribusi program manfaat,keluhan
ubah faktur pajak,keluhan
mata hati cinta gila gila mata hati cinta gila gila mata hati cinta gila gila,pujian
ajak prof pegawai ri makan bareng anak anak sekolah menu lihat ekspresi anak anak jadi obyek perintah program mentah hasil anak anak racun anggar salah serap sekian triliun,keluhan
porsi sesuai nampan beda cerita menang tertawa lucu,pujian
rujuk salah periksa benjol tangan dokter bedah saran dokter spesialis dokter bedah benjol operasi alas benjol admin tidak operasi benjol admin tunggu bahaya daftar aplikasi ikut prosedur operasi biaya pribadi mohon jelas,keluhan
nyala wi,pujian
kocak,keluhan
wajah hati cinta,pujian
syarat sertipikat mudah penuh konon milik jabat anggota dewan mata senyum gembira tawa mata lebar senyum lebar gembira mata lebar senyum lebar gembira mata lebar senyum lebar gembira menang tertawa lucu,keluhan
gue,keluhan
pecat niat kerja,keluhan
anak daftar tunggak status kartu aktif tangguh,keluhan
kode verifikasi banget muncul oi,keluhan
saran distribusi sekolah sekolah jaga cegah tugas sekolah giat luput awas,saran
profesionalisme hilang,keluhan
halo admin jakarta rujuk majalengka beda daerah admin,saran
gizi banget,pujian
tepuk tangan apresiasi puji tepuk tangan apresiasi puji,pujian
moga lancar,pujian
admin maaf salah super lot mohon ampun kasih denda sangsi apa marah atas kena denda sangsi tangan angkat raya sukses,keluhan
ketua saran serangga penuh protein makan,keluhan
gaji turun,keluhan
tangan angkat raya sukses tangan angkat raya sukses,pujian
yayasan aju titik prosedural koordinasi meta lokasi desa lampu hijau desa dapur kali aju titik sistem tolak alas kuota penuh serius bangun daerah anak rasa program solusi atas wilayah daerah ri,saran
batam,keluhan
kamera,keluhan
oknum oknum kayak santai lega damai,keluhan
dampak solusi bikin kerja tumpuk beres beres susah wajah leleh panas canggung,keluhan
real darah merah menang sedu sedu sedih ekstrem,keluhan
petinggi ahli gizi menang tertawa lucu,keluhan
admin mandiri kakak bikin orang,saran
bikin badan gagal allah tahap,keluhan
kantor aktif perlu kuliah kuota non bayar urus bayar anggota keluarga kartu kampung admin,keluhan
tutorial buat bikin daftar gilir verifikasi no email email no ku aktif kenal,keluhan
pagi sore malam jam pagi lancar habis darah,keluhan
admin balas,saran
moga tunggu amin,pujian
program elite gaji sulit,keluhan
admin cek,saran
banget eror,keluhan
lot,keluhan
apoteker admin,saran
dirgahayu badan gizi nasional republik indonesia tubuh manusia mesin biologis identitas martabat manusia jaga gizi jaga martabat malnutrisi ingkar hakikat manusia makhluk layak kembang utuh fisik mental spiritual,pujian
halo admin ubah iur mandiri,saran
akses tanggal sebentar sukses bikin benar,keluhan
ampun bikin badan tahap bikin berat badan,keluhan
asam lambung terima sakit main minim suntik kayak kayak tolak camat muntah darah bab darah parah obat asal main kambuh muntah darah bab darah opname sadar rasa sakit muntah darah bab lemas pusing minggu catat pulang drop masuk asam lambung pakai [BADWORD] [BADWORD],keluhan
lapor yuk aktivasi akun senyum keringat dingin bahagia lega tawa canggung,saran
baru racun,keluhan
admin akun lupa suruh tunggu verifikasi kode coba kirim admin besok puskesmas ku,keluhan
ampuh efektif indonesia tertawa,keluhan
tambah formasi rawan dapur tugas awas makan seko santap siswa dapur antar serah terima sekolah ruang rawan manfaat oknum sabotase dapur awas guru seko harap makan santap aman sabotase racun terap olah dapur masalah,saran
malam internal server unggah,keluhan
rekan tau non posisi pakai rutin menang sedih rantau susah urus non aktif rutin pakai nama laku sesuai indonesia,keluhan
moga lancar,pujian
[BADWORD] eror,keluhan
bikin tombol tes pakai kelinci coba langsung kerja,keluhan
admin baca komen sih unggah pajak masuk masuk cerita menang tertawa lucu menang tertawa lucu,keluhan
janji demo turun cepat cat anak,keluhan
sih dad statistik anak racun buru evaluasi [BADWORD] langsung turun dapur stop rapat [BADWORD] banget kirim sekolah sibuk bicara [BADWORD] banget gemas gue kerja,keluhan
cema jempol tuju bagus,pujian
izin beda terima karang bawa makan banding balik kota detik,saran
[BADWORD] benar kasih bantu,keluhan
aktif,saran
susah menang sedu sedu sedih ekstrem ampun banget deh tuhan,keluhan
daftar kader admin lowong,saran
aplikasi akses jam sih,keluhan
bilang diskon listrik bagus banget ganti ladang korupsi,keluhan
lulus lulus aceh,keluhan
to angka koma hasil bulat sih admin,keluhan
kak susah cek santai lega damai,keluhan
tepuk tangan apresiasi puji tepuk tangan apresiasi puji tepuk tangan apresiasi puji,pujian
tanggal gin tutorial,keluhan
zoom [BADWORD] edar resmi jam siang amatir banget lembaga,keluhan
aduh kredit terbit kredit khusus dokumen sama normal pas periksa salah laku kredit,keluhan
tepuk tangan apresiasi puji tepuk tangan apresiasi puji tepuk tangan apresiasi puji,pujian
lapor mei merah proses barangkali tau solusi bagi man teman,keluhan
menu gizi standar lihat menu ampun deh awas,keluhan
tepuk tangan apresiasi puji tepuk tangan apresiasi puji mata hati cinta gila gila,pujian
[BADWORD] tawan korupsi nih iya duit pajak jadi anak jabat,keluhan
kakak tambah anggota,saran
sarang [BADWORD] isi orang [BADWORD] ar [BADWORD] [BADWORD] tukang palak,keluhan
yuk aktif akun,saran
bikin konten sistem benar [BADWORD],keluhan
akting main sinetron,keluhan
unggah pagi kerja admin,keluhan
ri anjing kepala kau manusia tamak,keluhan
halo admin lahir normal bayar menang tertawa lucu,keluhan
admin bikin akun susah admin,keluhan
halo kak saran mohon wadah prosesi rekrutmen kak hindar nepotisme komentar keluh,saran
ah kerja sih,keluhan
lapor,saran
sekolah anak tempe nasi susu anggur biji tomat iris menang tertawa lucu protein hewani,keluhan
admin keluh buat atur atur september kunjung batas minggu logika pasien rujuk tipe konsultasi tindak minggu kali pasien sakit parah kanker pacu hari lucu banget pasien kanker suruh tunggu tanggung pasien tinggal tunggu tindak buat atur bikin atur mbok pakai empati rasa susah hidup rakyat jelata mbok paham rakyat jelata gantung bantu biaya sehat beda jabat rakyat,keluhan
korup,pujian
gizi racun hebat,keluhan
saldo deposit susah,keluhan
baik versi kuasa,keluhan
halo admin bantu cerah ku cek admin,saran
uang muka tanggal sekian masuk no faktur kolom referensi centang uang muka edit,keluhan
nama sekolah pindah yayasan,keluhan
sih kerja sih senin benar janji menteri garang mat,keluhan
kejar kejar kasih faktur pajak tanggal revisi faktur nih gebrak nyala banget nih pajak,keluhan
api,pujian
kolom tindak deh,keluhan
jari umpat,keluhan
potong pulsa sih,keluhan
aju mohon puter admin,keluhan
cek adu,saran
menu tindak,keluhan
bang,keluhan
keramas irit nih,keluhan
[BADWORD],keluhan
admin pindah jakarta in wilayah jakarta,saran
sistem lu,keluhan
[BADWORD] banget pakai buru tunggu,keluhan
capai banget,keluhan
admin,keluhan
lulus lulus maksud negara,keluhan
unggah oi parah,keluhan
rumit kali bilang nik salah akun bilang no nik salah,keluhan
mohon maaf kendala web stabil mohon coba kala terima kasih tangan doa mohon terima kasih syukur,keluhan
nih admin aktif taun lunas mohon info tangan doa mohon terima kasih syukur tangan doa mohon terima kasih syukur tangan doa mohon terima kasih syukur,saran
sekian juta terima racun persentase sekian persen sekian pure ngeri orang indonesia nih program celah langsung henti program serap minimal kerja evaluasi wajib demo tuntut henti sih serah deh atur maju menang tertawa lucu,keluhan
ciamis,keluhan
serius kakak sih nomor jasa kirim kode ubah,keluhan
kabar kota bogor bagi,keluhan
bayar deposit pajak betul teknis,saran
salah anggota perihal gaji bayar titik terang mata senyum pipi rona senang puas tepuk tangan apresiasi puji tangan angkat raya sukses,keluhan
si admin,saran
karyawan olahraga pas menteri uang negara pakai sih olahraga,keluhan
izin dapat adil pakai realistis fokus daerah anggap pukul makan anak orang kayak cucu makan racun program bagus dana potong anggar dana kasihan anak sekolah kuliah saran opsi kelola sekolah kantin uang kasih biar makan siswa pakai dapur yayasan masak porsi tambah uang porsi potong untung yayasan untung juta margin untung porsi kali untung anggar lai dana gaji karyawan beda porsi maka jasa yayasan dapur batas porsi audit untung yayasan lai siswa sisa uang kasih cerita potong potong anak makan minimal makan makan orang tua rela makan anak makan dana dalih ekonomi rakyat kena dampak negatif mahal jual lai sepi ayo bu,saran
senin eror,keluhan
pantau jam,keluhan
astaga oi,keluhan
badan program sayang sistem internal kelola amburadul kurang tingkat tambah gaji cair magang jelas magang bosan magang efektif kerja lantar bosan magang moga langsung turun cek internal percaya data data,keluhan
masuk kredit masuk faktur pajak admin bantu,keluhan
serius begini gue,keluhan
selesai sempurna sistem akses selesai badan,saran
admin pasien minimal kali jadwal kunjung beda dokter pas ambil antre aplikasi daftar dokter beda nyata pas apes niat biar bolak jarak rumah lumayan bikin jadwal ulang,keluhan
cek kak,saran
orang budek kayak orang [BADWORD] bayar sulit nih pimpin isi orang [BADWORD],keluhan
inti kerja,saran
salah racun proses kantin sekolah kuar,keluhan
surat resmi terima januari ku februari doang laku,keluhan
kocak,keluhan
jenderal kecut ayo gaji pakai duit rakyat anak guru tinggal gara,keluhan
evaluasi,saran
kerja becus,keluhan
capai admin lembur hasil mending goreng telur biar hasil,keluhan
inti politik janji pegawai gaib gaji habis nongol,keluhan
baik situs mi tanggal si unifikasi,keluhan
sip jempol tuju bagus,pujian
panggil nih pajak tanggung,keluhan
admin aplikasi,keluhan
iya sekian ribu terima manfaat angka maksimal tenaga serap angka ribu juta lapang kerja juta lapang kerja mata senyum gembira tawa,saran
mata hati cinta gila gila,pujian
iya mata hati cinta gila gila,pujian
lot banget sih menang sedu sedu sedih ekstrem menang sedu sedu sedih ekstrem menang sedu sedu sedih ekstrem,keluhan
halo mohon info kelas bekas kota operasi kelas prosedur langsung butuh rujuk puskesmas puskesmas rujuk,keluhan
keren,pujian
kerja jam gaji bayar,keluhan
daftar,saran
menang tertawa lucu menang tertawa lucu menang tertawa lucu menang tertawa lucu kerja,keluhan
sekolah,keluhan
aktif akun,saran
benar beres heran sih jadi kelinci coba,keluhan
mantap sistem lancar jam malam subuh,keluhan
nak menang sedu sedu sedih ekstrem,pujian
cepat baik filter tarik data jam sistem mudah pikir kerja orang doang zalim lihat susah puluh juta orang akunting lihat nyanyi balas dunia moga sulit,keluhan
[BADWORD] orang tuli [BADWORD] kayak jabat mudun koe [BADWORD],keluhan
selamat pagi admin izin iur bayar sehat kelas tangan doa mohon terima kasih syukur,saran
dirgahayu badan gizi nasional,pujian
daftar kode verifikasi masuk masuk admin,keluhan
badan racun gratis nih,keluhan
julur lidah nikmat makan situasi julur lidah nikmat makan situasi julur lidah nikmat makan situasi julur lidah nikmat makan situasi julur lidah nikmat makan situasi julur lidah nikmat makan situasi julur lidah nikmat makan situasi julur lidah nikmat makan situasi julur lidah nikmat makan situasi,pujian
eror admin,saran
bu impor nih kemarin paham sistem sistem beres menang tertawa lucu,keluhan
admin kipas debu bawa bakteri,keluhan
selamat sore admin izin ayah sakit jantung fungsi jantung kontrol obat tunjang fungsi jantung kontrol obat batas mohon jelas kak tangan doa mohon terima kasih syukur,keluhan
ha,keluhan
mesti data makan buang anak murid suruh bawa kotak makan sekolah makan bawa pulang dapur terima sisa makan biar habis makan siswa bawa pulang rumah buang makan basi ngeri racun,saran
sampah lapak orang tahan bulan ubah kacau,keluhan
sulit unggah keluar puter tulis,keluhan
kena panah jamin tinggal daerah konflik,saran
yuk tos,saran
menang doang minimal harakiri,keluhan
wacana perintah hapus tunggak mei,saran
menang tertawa lucu,keluhan
ri,saran
penting awas bu oknum ajar [BADWORD] biar ketua kena sih,keluhan
[BADWORD] iya sistem mahal kayak,keluhan
menu anggar korupsi mata senyum gembira tawa,pujian
cermat untung orang orang uang jadi kayak kayak miskin miskin usul kembali sekolah lingkung rasa warung sekitar sekolah kantin kantin rasa,keluhan
senin oktober kantor pajak ganti no email telepon rekan solusi langsung kantor pajak baru tangan aduh tinggal kantor pajak jauh ganti no email akun pajak pribadi kantor pajak langsung allah istri ubah alamat alamat sesuai aju tanjung priok jakarta utara tolak langsung otomatis ubah alamat sesuai guna padan nik ragu data syarat administrasi,keluhan
benar,keluhan
dok edukasi tepuk tangan apresiasi puji,pujian
racun berani tanggung mental psikis anak mental anak tau niat anak and laku,keluhan
mudah praktik,keluhan
masyaallah menang sedih menang sedih,pujian
selamat ulang presiden terima kasih peduli program makan gizi gratis hadir senyum semangat anak anak indonesia doa baik moga sehat kuat kah langkah pimpin negeri,pujian
gas sih,pujian
benar pakai id kotor buruk jijik jam [BADWORD] kali rugi sadar bu solusi,keluhan
ketu forum bangga cerita anak minum susu liter tb ahli gizi indonesia dunia geleng bodoh laku minum air matang aman liter gelas menang sedih,keluhan
kalimat duga tanda rencana matang analisis dalam kaji duga risiko identifikasi risiko menang sedih tangan doa mohon terima kasih syukur,keluhan
serta lulus ubah lulus jelas,keluhan
gaji,keluhan
halo admin daftar,keluhan
